### ISSUE TITLE
Egress not working when pods are not on the same node as EIP

### ISSUE THREAD

**Issue by Ssshafi** [spidernet-io/egressgateway#1797]
**Describe the version**
Egress Gateway 0.6.5

3 Nodes Cluster (1 Master & 2 workers) :
	- OS : RockyLinux 9.6
	- Kubernetes v1.26.15
	- Calico CNI v3.28.1
	- MetalLB v0.15.2

**Describe the bug**
Egress only working when pod is on the worker node handling the EIP.
If pod is on the other worker node (labeleled as egress node or not) egress traffic is not send outside the cluster.

I've followed troubleshooting guide and all tests went well.

**How To Reproduce**
- Fresh install of the 3 node cluster with calico and metallb.
- Patch calico felixconfiguration chainInsertMode.
- Install Egress Gateway with helm : helm install egressgateway egressgateway/egressgateway -n egress-gateway --set feature.tunnelIpv4Subnet="192.200.0.1/16" --set controller.replicas=2 --wait --debug
- Apply the gateway conf : 
```
apiVersion: egressgateway.spidernet.io/v1beta1
kind: EgressGateway
metadata:
  name: default
spec:
  ippools:
	ipv4:
	  - "172.18.102.206-172.18.102.209"
  nodeSelector:
	selector:
	  matchLabels:
		egressgateway: "true"
```
- Label a worker node (kubectl label node worker2 egressgateway="true")
- Create a workload (basic nginx image) on node worker1 (Pod IP=10.111.115.87)
- Apply a egress policy : 
```
apiVersion: egressgateway.spidernet.io/v1beta1
kind: EgressPolicy
metadata:
  name: nginx-test
  namespace: nginx-test
spec:
  egressGatewayName: default
  appliedTo:
	podSelector:
	  matchLabels:
		app: nginx-test
  egressIP:
	ipv4: "172.18.102.207"
  destSubnet:
	- 172.18.9.26/32
```

**Expected behavior**
Traffic from pod should go outside of the cluster with Egress IP even if the pod is not on the same node as the EIP.

**Screenshots and log**
Running tcpdump on all workers nodes checking for dest IP (tcpdump -nvi any host 172.18.9.26). 
Traffic is being forwarded correctly beetween nodes but there is no traffic with Egress IP and therefore no recieved traffic.

Pod's node (worker1):
```
15:08:35.884464 cali0e1d1e4d521 In  IP (tos 0x0, ttl 64, id 10601, offset 0, flags [DF], proto ICMP (1), length 84)
    10.111.115.87 > 172.18.9.26: ICMP echo request, id 243, seq 1955, length 64
15:08:35.884485 egress.vxlan Out IP (tos 0x0, ttl 63, id 10601, offset 0, flags [DF], proto ICMP (1), length 84)
    10.111.115.87 > 172.18.9.26: ICMP echo request, id 243, seq 1955, length 64
15:08:36.908472 cali0e1d1e4d521 In  IP (tos 0x0, ttl 64, id 11340, offset 0, flags [DF], proto ICMP (1), length 84)
    10.111.115.87 > 172.18.9.26: ICMP echo request, id 243, seq 1956, length 64
15:08:36.908495 egress.vxlan Out IP (tos 0x0, ttl 63, id 11340, offset 0, flags [DF], proto ICMP (1), length 84)
    10.111.115.87 > 172.18.9.26: ICMP echo request, id 243, seq 1956, length 64
15:08:37.932469 cali0e1d1e4d521 In  IP (tos 0x0, ttl 64, id 12271, offset 0, flags [DF], proto ICMP (1), length 84)
    10.111.115.87 > 172.18.9.26: ICMP echo request, id 243, seq 1957, length 64
15:08:37.932492 egress.vxlan Out IP (tos 0x0, ttl 63, id 12271, offset 0, flags [DF], proto ICMP (1), length 84)
    10.111.115.87 > 172.18.9.26: ICMP echo request, id 243, seq 1957, length 64
15:08:38.956544 cali0e1d1e4d521 In  IP (tos 0x0, ttl 64, id 12556, offset 0, flags [DF], proto ICMP (1), length 84)
    10.111.115.87 > 172.18.9.26: ICMP echo request, id 243, seq 1958, length 64
15:08:38.956571 egress.vxlan Out IP (tos 0x0, ttl 63, id 12556, offset 0, flags [DF], proto ICMP (1), length 84)
    10.111.115.87 > 172.18.9.26: ICMP echo request, id 243, seq 1958, length 64
15:08:39.980499 cali0e1d1e4d521 In  IP (tos 0x0, ttl 64, id 12770, offset 0, flags [DF], proto ICMP (1), length 84)
    10.111.115.87 > 172.18.9.26: ICMP echo request, id 243, seq 1959, length 64
15:08:39.980523 egress.vxlan Out IP (tos 0x0, ttl 63, id 12770, offset 0, flags [DF], proto ICMP (1), length 84)
    10.111.115.87 > 172.18.9.26: ICMP echo request, id 243, seq 1959, length 64
15:08:41.004509 cali0e1d1e4d521 In  IP (tos 0x0, ttl 64, id 12998, offset 0, flags [DF], proto ICMP (1), length 84)
    10.111.115.87 > 172.18.9.26: ICMP echo request, id 243, seq 1960, length 64
15:08:41.004526 egress.vxlan Out IP (tos 0x0, ttl 63, id 12998, offset 0, flags [DF], proto ICMP (1), length 84)
    10.111.115.87 > 172.18.9.26: ICMP echo request, id 243, seq 1960, length 64
```

EIP node (worker2) :
```
15:08:35.884632 egress.vxlan In  IP (tos 0x0, ttl 63, id 10601, offset 0, flags [DF], proto ICMP (1), length 84)
    10.111.115.87 > 172.18.9.26: ICMP echo request, id 243, seq 1955, length 64
15:08:36.908662 egress.vxlan In  IP (tos 0x0, ttl 63, id 11340, offset 0, flags [DF], proto ICMP (1), length 84)
    10.111.115.87 > 172.18.9.26: ICMP echo request, id 243, seq 1956, length 64
15:08:37.932656 egress.vxlan In  IP (tos 0x0, ttl 63, id 12271, offset 0, flags [DF], proto ICMP (1), length 84)
    10.111.115.87 > 172.18.9.26: ICMP echo request, id 243, seq 1957, length 64
15:08:38.956748 egress.vxlan In  IP (tos 0x0, ttl 63, id 12556, offset 0, flags [DF], proto ICMP (1), length 84)
    10.111.115.87 > 172.18.9.26: ICMP echo request, id 243, seq 1958, length 64
15:08:39.980695 egress.vxlan In  IP (tos 0x0, ttl 63, id 12770, offset 0, flags [DF], proto ICMP (1), length 84)
    10.111.115.87 > 172.18.9.26: ICMP echo request, id 243, seq 1959, length 64
15:08:41.004669 egress.vxlan In  IP (tos 0x0, ttl 63, id 12998, offset 0, flags [DF], proto ICMP (1), length 84)
    10.111.115.87 > 172.18.9.26: ICMP echo request, id 243, seq 1960, length 64
```

When Pod and EIP are on the same node, all is good. :
```
15:28:52.777787 cali61a5c49d360 In  IP (tos 0x0, ttl 64, id 29812, offset 0, flags [DF], proto ICMP (1), length 84)
    10.111.115.87 > 172.18.9.26: ICMP echo request, id 363, seq 10, length 64
15:28:52.777813 ens192 Out IP (tos 0x0, ttl 63, id 29812, offset 0, flags [DF], proto ICMP (1), length 84)
    172.18.102.207 > 172.18.9.26: ICMP echo request, id 363, seq 10, length 64
15:28:52.779627 ens192 In  IP (tos 0x0, ttl 62, id 63231, offset 0, flags [none], proto ICMP (1), length 84)
    172.18.9.26 > 172.18.102.207: ICMP echo reply, id 363, seq 10, length 64
15:28:52.779644 cali61a5c49d360 Out IP (tos 0x0, ttl 61, id 63231, offset 0, flags [none], proto ICMP (1), length 84)
    172.18.9.26 > 10.111.115.87: ICMP echo reply, id 363, seq 10, length 64
```

**Additional context**
I don't know if I missed something to configure or if it is the same problem as [#1782](https://github.com/spidernet-io/egressgateway/issues/1782) or 
[#1616](https://github.com/spidernet-io/egressgateway/issues/1616) because problems sounds equals but symptoms are differents...

**Comment by Ssshafi** [comment]
I made a trace in iptables for these paquets and It seems that paquet is drop silently after nat/prerouting...
But for now I can't find why...???
```
[root@kubetest-w2 ~]# xtables-monitor --trace
PACKET: 2 b077d09e IN=egress.vxlan MACSRC=66:55:1d:cd:ae:d8 MACDST=66:87:86:d1:81:b MACPROTO=0800 SRC=10.111.115.95 DST=172.18.9.26 LEN=60 TOS=0x0 TTL=63 ID=48515 DF SPORT=42518 DPORT=443 SYN
 TRACE: 2 b077d09e raw:PREROUTING:rule:0x1b:CONTINUE  -4 -t raw -A PREROUTING -d 172.18.9.26/32 -j TRACE
 TRACE: 2 b077d09e raw:PREROUTING:rule:0x18:JUMP:cali-PREROUTING  -4 -t raw -A PREROUTING -m comment --comment "cali:6gwbT8clXdHdC1b1" -j cali-PREROUTING
 TRACE: 2 b077d09e raw:cali-PREROUTING:rule:0x9:CONTINUE  -4 -t raw -A cali-PREROUTING -m comment --comment "cali:XFX5xbM8B9qR10JG" -j MARK --set-xmark 0x0/0xf0000
 TRACE: 2 b077d09e raw:cali-PREROUTING:rule:0xd:JUMP:cali-from-host-endpoint  -4 -t raw -A cali-PREROUTING -m comment --comment "cali:ImU0-4Rl2WoOI9Ou" -m mark --mark 0x0/0x40000 -j cali-from-host-endpoint
 TRACE: 2 b077d09e raw:cali-PREROUTING:rule:0xe:CONTINUE  -4 -t raw -A cali-PREROUTING -m comment --comment "cali:lV4V2MPoMBf0hl9T" -m mark --mark 0x10000/0x10000 -j ACCEPT
 TRACE: 2 b077d09e raw:PREROUTING:policy:ACCEPT
PACKET: 2 b077d09e IN=egress.vxlan MACSRC=66:55:1d:cd:ae:d8 MACDST=66:87:86:d1:81:b MACPROTO=0800 SRC=10.111.115.95 DST=172.18.9.26 LEN=60 TOS=0x0 TTL=63 ID=48515 DF SPORT=42518 DPORT=443 SYN
 TRACE: 2 b077d09e mangle:PREROUTING:rule:0xd6:JUMP:EGRESSGATEWAY-MARK-REQUEST  -4 -t mangle -A PREROUTING -m comment --comment "egw:Lh98b3mb9WlZrgw7" -m comment --comment "Checking for EgressPolicy matched traffic" -j EGRESSGATEWAY-MARK-REQUEST
 TRACE: 2 b077d09e mangle:PREROUTING:rule:0xd5:JUMP:EGRESSGATEWAY-REPLY-ROUTING  -4 -t mangle -A PREROUTING -m comment --comment "egw:T0xtgSfAE9gtzdEV" -m comment --comment "EgressGateway reply datapath rule, rule is from the EgressGateway" -j EGRESSGATEWAY-REPLY-ROUTING
 TRACE: 2 b077d09e mangle:EGRESSGATEWAY-REPLY-ROUTING:rule:0xca:CONTINUE  -4 -t mangle -A EGRESSGATEWAY-REPLY-ROUTING -i egress.vxlan -m comment --comment "egw:0t-1nlAAl0iorQIj" -m comment --comment "Mark the traffic from the EgressGateway tunnel, rule is from the EgressGateway" -m mac --mac-source 66:55:1d:cd:ae:d8 -m conntrack --ctdir ORIGINAL -j MARK --set-xmark 0x26e68522/0xffffffff
 TRACE: 2 b077d09e mangle:EGRESSGATEWAY-REPLY-ROUTING:rule:0xcb:CONTINUE  -4 -t mangle -A EGRESSGATEWAY-REPLY-ROUTING -m comment --comment "egw:T6bhYpHQ9tubccz7" -m comment --comment "Save mark to the connection, rule is from the EgressGateway" -m mark --mark 0x26e68522 -j CONNMARK --save-mark --nfmask 0xffffffff --ctmask 0xffffffff
 TRACE: 2 b077d09e mangle:EGRESSGATEWAY-REPLY-ROUTING:rule:0xcc:CONTINUE  -4 -t mangle -A EGRESSGATEWAY-REPLY-ROUTING -i egress.vxlan -m comment --comment "egw:A5h9xsWzWg6lTorg" -m comment --comment "Clear Mark of the inner package, rule is from the EgressGateway" -m mac --mac-source 66:55:1d:cd:ae:d8 -j MARK --set-xmark 0x26000000/0xffffffff
 TRACE: 2 b077d09e mangle:EGRESSGATEWAY-REPLY-ROUTING:rule:0xd0:CONTINUE  -4 -t mangle -A EGRESSGATEWAY-REPLY-ROUTING -m comment --comment "egw:H5GUX0ZysKdC2LEp" -m comment --comment "label for restoring connections, rule is from the EgressGateway" -m conntrack --ctdir REPLY -j CONNMARK --restore-mark --nfmask 0xffffffff --ctmask 0xffffffff
 TRACE: 2 b077d09e mangle:PREROUTING:rule:0xd4:ACCEPT  -4 -t mangle -A PREROUTING -m comment --comment "egw:20t7-AOmvc7_sCzR" -m comment --comment "EgressGateway reply datapath rule, rule is from the EgressGateway" -m mark --mark 0x26000000/0xff000000 -j ACCEPT
PACKET: 2 b077d09e IN=egress.vxlan MACSRC=66:55:1d:cd:ae:d8 MACDST=66:87:86:d1:81:b MACPROTO=0800 SRC=10.111.115.95 DST=172.18.9.26 LEN=60 TOS=0x0 TTL=63 ID=48515 DF SPORT=42518 DPORT=443 SYN MARK=0x26000000
 TRACE: 2 b077d09e nat:PREROUTING:rule:0x2d28:ACCEPT  -4 -t nat -A PREROUTING -m comment --comment "egw:bx14gEwdI2z4JR7V" -m comment --comment "EgressGateway traffic accept datapath rule" -m mark --mark 0x26000000/0xff000000 -j ACCEPT
```

**Comment by Ssshafi** [comment]
Sure,
Since my first post, pod on worker change is IP, now it is 10.111.115.95.

```
[root@kubetest-w2 ~]# tcpdump -i egress.vxlan -nnvvee host 10.111.115.95
dropped privs to tcpdump
tcpdump: listening on egress.vxlan, link-type EN10MB (Ethernet), snapshot length 262144 bytes
13:36:47.405410 66:55:1d:cd:ae:d8 > 66:87:86:d1:81:0b, ethertype IPv4 (0x0800), length 74: (tos 0x0, ttl 63, id 28522, offset 0, flags [DF], proto TCP (6), length 60)
    10.111.115.95.52212 > 172.18.9.26.443: Flags [S], cksum 0x518a (correct), seq 2264177022, win 64800, options [mss 1440,sackOK,TS val 2322877911 ecr 0,nop,wscale 7], length 0
13:36:48.428076 66:55:1d:cd:ae:d8 > 66:87:86:d1:81:0b, ethertype IPv4 (0x0800), length 74: (tos 0x0, ttl 63, id 28523, offset 0, flags [DF], proto TCP (6), length 60)
    10.111.115.95.52212 > 172.18.9.26.443: Flags [S], cksum 0x4d8b (correct), seq 2264177022, win 64800, options [mss 1440,sackOK,TS val 2322878934 ecr 0,nop,wscale 7], length 0
13:36:50.476071 66:55:1d:cd:ae:d8 > 66:87:86:d1:81:0b, ethertype IPv4 (0x0800), length 74: (tos 0x0, ttl 63, id 28524, offset 0, flags [DF], proto TCP (6), length 60)
    10.111.115.95.52212 > 172.18.9.26.443: Flags [S], cksum 0x458b (correct), seq 2264177022, win 64800, options [mss 1440,sackOK,TS val 2322880982 ecr 0,nop,wscale 7], length 0
13:36:54.508039 66:55:1d:cd:ae:d8 > 66:87:86:d1:81:0b, ethertype IPv4 (0x0800), length 74: (tos 0x0, ttl 63, id 28525, offset 0, flags [DF], proto TCP (6), length 60)
    10.111.115.95.52212 > 172.18.9.26.443: Flags [S], cksum 0x35cb (correct), seq 2264177022, win 64800, options [mss 1440,sackOK,TS val 2322885014 ecr 0,nop,wscale 7], length 0
13:37:02.957149 66:55:1d:cd:ae:d8 > 66:87:86:d1:81:0b, ethertype IPv4 (0x0800), length 74: (tos 0x0, ttl 63, id 28526, offset 0, flags [DF], proto TCP (6), length 60)
    10.111.115.95.52212 > 172.18.9.26.443: Flags [S], cksum 0x14ca (correct), seq 2264177022, win 64800, options [mss 1440,sackOK,TS val 2322893463 ecr 0,nop,wscale 7], length 0
13:37:19.340118 66:55:1d:cd:ae:d8 > 66:87:86:d1:81:0b, ethertype IPv4 (0x0800), length 74: (tos 0x0, ttl 63, id 28527, offset 0, flags [DF], proto TCP (6), length 60)
    10.111.115.95.52212 > 172.18.9.26.443: Flags [S], cksum 0xd4ca (correct), seq 2264177022, win 64800, options [mss 1440,sackOK,TS val 2322909846 ecr 0,nop,wscale 7], length 0
```

**Comment by Ssshafi** [comment]
That what I do [here](https://github.com/spidernet-io/egressgateway/issues/1797#issuecomment-3265275911).

```
[root@kubetest-w2 ~]# xtables-monitor --trace
PACKET: 2 a6c082f5 IN=egress.vxlan MACSRC=66:55:1d:cd:ae:d8 MACDST=66:87:86:d1:81:b MACPROTO=0800 SRC=10.111.115.95 DST=172.18.9.26 LEN=60 TOS=0x0 TTL=63 ID=9458 DF SPORT=53150 DPORT=443 SYN
 TRACE: 2 a6c082f5 raw:PREROUTING:rule:0x1b:CONTINUE  -4 -t raw -A PREROUTING -d 172.18.9.26/32 -j TRACE
 TRACE: 2 a6c082f5 raw:PREROUTING:rule:0x18:JUMP:cali-PREROUTING  -4 -t raw -A PREROUTING -m comment --comment "cali:6gwbT8clXdHdC1b1" -j cali-PREROUTING
 TRACE: 2 a6c082f5 raw:cali-PREROUTING:rule:0x9:CONTINUE  -4 -t raw -A cali-PREROUTING -m comment --comment "cali:XFX5xbM8B9qR10JG" -j MARK --set-xmark 0x0/0xf0000
 TRACE: 2 a6c082f5 raw:cali-PREROUTING:rule:0xd:JUMP:cali-from-host-endpoint  -4 -t raw -A cali-PREROUTING -m comment --comment "cali:ImU0-4Rl2WoOI9Ou" -m mark --mark 0x0/0x40000 -j cali-from-host-endpoint
 TRACE: 2 a6c082f5 raw:cali-PREROUTING:rule:0xe:CONTINUE  -4 -t raw -A cali-PREROUTING -m comment --comment "cali:lV4V2MPoMBf0hl9T" -m mark --mark 0x10000/0x10000 -j ACCEPT
 TRACE: 2 a6c082f5 raw:PREROUTING:policy:ACCEPT
PACKET: 2 a6c082f5 IN=egress.vxlan MACSRC=66:55:1d:cd:ae:d8 MACDST=66:87:86:d1:81:b MACPROTO=0800 SRC=10.111.115.95 DST=172.18.9.26 LEN=60 TOS=0x0 TTL=63 ID=9458 DF SPORT=53150 DPORT=443 SYN
 TRACE: 2 a6c082f5 mangle:PREROUTING:rule:0xd6:JUMP:EGRESSGATEWAY-MARK-REQUEST  -4 -t mangle -A PREROUTING -m comment --comment "egw:Lh98b3mb9WlZrgw7" -m comment --comment "Checking for EgressPolicy matched traffic" -j EGRESSGATEWAY-MARK-REQUEST
 TRACE: 2 a6c082f5 mangle:PREROUTING:rule:0xd5:JUMP:EGRESSGATEWAY-REPLY-ROUTING  -4 -t mangle -A PREROUTING -m comment --comment "egw:T0xtgSfAE9gtzdEV" -m comment --comment "EgressGateway reply datapath rule, rule is from the EgressGateway" -j EGRESSGATEWAY-REPLY-ROUTING
 TRACE: 2 a6c082f5 mangle:EGRESSGATEWAY-REPLY-ROUTING:rule:0x22b:CONTINUE  -4 -t mangle -A EGRESSGATEWAY-REPLY-ROUTING -i egress.vxlan -m comment --comment "egw:y3lxUQXpSCdpPYXj" -m comment --comment "Mark the traffic from the EgressGateway tunnel, rule is from the EgressGateway" -m mac --mac-source 66:55:1d:cd:ae:d8 -m conntrack --ctdir ORIGINAL -j MARK --set-xmark 0x26e68522/0xffffffff
 TRACE: 2 a6c082f5 mangle:EGRESSGATEWAY-REPLY-ROUTING:rule:0x22c:CONTINUE  -4 -t mangle -A EGRESSGATEWAY-REPLY-ROUTING -m comment --comment "egw:BJ7f2_6mtiX56k6p" -m comment --comment "Save mark to the connection, rule is from the EgressGateway" -m mark --mark 0x26e68522 -j CONNMARK --save-mark --nfmask 0xffffffff --ctmask 0xffffffff
 TRACE: 2 a6c082f5 mangle:EGRESSGATEWAY-REPLY-ROUTING:rule:0x22d:CONTINUE  -4 -t mangle -A EGRESSGATEWAY-REPLY-ROUTING -i egress.vxlan -m comment --comment "egw:U4xgZRmrG3QOoLe0" -m comment --comment "Clear Mark of the inner package, rule is from the EgressGateway" -m mac --mac-source 66:55:1d:cd:ae:d8 -j MARK --set-xmark 0x26000000/0xffffffff
 TRACE: 2 a6c082f5 mangle:EGRESSGATEWAY-REPLY-ROUTING:rule:0x22e:CONTINUE  -4 -t mangle -A EGRESSGATEWAY-REPLY-ROUTING -m comment --comment "egw:e_DPYmSrjODDpMOg" -m comment --comment "label for restoring connections, rule is from the EgressGateway" -m conntrack --ctdir REPLY -j CONNMARK --restore-mark --nfmask 0xffffffff --ctmask 0xffffffff
 TRACE: 2 a6c082f5 mangle:PREROUTING:rule:0xd4:ACCEPT  -4 -t mangle -A PREROUTING -m comment --comment "egw:20t7-AOmvc7_sCzR" -m comment --comment "EgressGateway reply datapath rule, rule is from the EgressGateway" -m mark --mark 0x26000000/0xff000000 -j ACCEPT
PACKET: 2 a6c082f5 IN=egress.vxlan MACSRC=66:55:1d:cd:ae:d8 MACDST=66:87:86:d1:81:b MACPROTO=0800 SRC=10.111.115.95 DST=172.18.9.26 LEN=60 TOS=0x0 TTL=63 ID=9458 DF SPORT=53150 DPORT=443 SYN MARK=0x26000000
 TRACE: 2 a6c082f5 nat:PREROUTING:rule:0x6399:ACCEPT  -4 -t nat -A PREROUTING -m comment --comment "egw:bx14gEwdI2z4JR7V" -m comment --comment "EgressGateway traffic accept datapath rule" -m mark --mark 0x26000000/0xff000000 -j ACCEPT
PACKET: 2 0dffda42 IN=egress.vxlan MACSRC=66:55:1d:cd:ae:d8 MACDST=66:87:86:d1:81:b MACPROTO=0800 SRC=10.111.115.95 DST=172.18.9.26 LEN=60 TOS=0x0 TTL=63 ID=9459 DF SPORT=53150 DPORT=443 SYN
 TRACE: 2 0dffda42 raw:PREROUTING:rule:0x1b:CONTINUE  -4 -t raw -A PREROUTING -d 172.18.9.26/32 -j TRACE
 TRACE: 2 0dffda42 raw:PREROUTING:rule:0x18:JUMP:cali-PREROUTING  -4 -t raw -A PREROUTING -m comment --comment "cali:6gwbT8clXdHdC1b1" -j cali-PREROUTING
 TRACE: 2 0dffda42 raw:cali-PREROUTING:rule:0x9:CONTINUE  -4 -t raw -A cali-PREROUTING -m comment --comment "cali:XFX5xbM8B9qR10JG" -j MARK --set-xmark 0x0/0xf0000
 TRACE: 2 0dffda42 raw:cali-PREROUTING:rule:0xd:JUMP:cali-from-host-endpoint  -4 -t raw -A cali-PREROUTING -m comment --comment "cali:ImU0-4Rl2WoOI9Ou" -m mark --mark 0x0/0x40000 -j cali-from-host-endpoint
 TRACE: 2 0dffda42 raw:cali-PREROUTING:rule:0xe:CONTINUE  -4 -t raw -A cali-PREROUTING -m comment --comment "cali:lV4V2MPoMBf0hl9T" -m mark --mark 0x10000/0x10000 -j ACCEPT
 TRACE: 2 0dffda42 raw:PREROUTING:policy:ACCEPT
PACKET: 2 0dffda42 IN=egress.vxlan MACSRC=66:55:1d:cd:ae:d8 MACDST=66:87:86:d1:81:b MACPROTO=0800 SRC=10.111.115.95 DST=172.18.9.26 LEN=60 TOS=0x0 TTL=63 ID=9459 DF SPORT=53150 DPORT=443 SYN
 TRACE: 2 0dffda42 mangle:PREROUTING:rule:0xd6:JUMP:EGRESSGATEWAY-MARK-REQUEST  -4 -t mangle -A PREROUTING -m comment --comment "egw:Lh98b3mb9WlZrgw7" -m comment --comment "Checking for EgressPolicy matched traffic" -j EGRESSGATEWAY-MARK-REQUEST
 TRACE: 2 0dffda42 mangle:PREROUTING:rule:0xd5:JUMP:EGRESSGATEWAY-REPLY-ROUTING  -4 -t mangle -A PREROUTING -m comment --comment "egw:T0xtgSfAE9gtzdEV" -m comment --comment "EgressGateway reply datapath rule, rule is from the EgressGateway" -j EGRESSGATEWAY-REPLY-ROUTING
 TRACE: 2 0dffda42 mangle:EGRESSGATEWAY-REPLY-ROUTING:rule:0x22b:CONTINUE  -4 -t mangle -A EGRESSGATEWAY-REPLY-ROUTING -i egress.vxlan -m comment --comment "egw:y3lxUQXpSCdpPYXj" -m comment --comment "Mark the traffic from the EgressGateway tunnel, rule is from the EgressGateway" -m mac --mac-source 66:55:1d:cd:ae:d8 -m conntrack --ctdir ORIGINAL -j MARK --set-xmark 0x26e68522/0xffffffff
 TRACE: 2 0dffda42 mangle:EGRESSGATEWAY-REPLY-ROUTING:rule:0x22c:CONTINUE  -4 -t mangle -A EGRESSGATEWAY-REPLY-ROUTING -m comment --comment "egw:BJ7f2_6mtiX56k6p" -m comment --comment "Save mark to the connection, rule is from the EgressGateway" -m mark --mark 0x26e68522 -j CONNMARK --save-mark --nfmask 0xffffffff --ctmask 0xffffffff
 TRACE: 2 0dffda42 mangle:EGRESSGATEWAY-REPLY-ROUTING:rule:0x22d:CONTINUE  -4 -t mangle -A EGRESSGATEWAY-REPLY-ROUTING -i egress.vxlan -m comment --comment "egw:U4xgZRmrG3QOoLe0" -m comment --comment "Clear Mark of the inner package, rule is from the EgressGateway" -m mac --mac-source 66:55:1d:cd:ae:d8 -j MARK --set-xmark 0x26000000/0xffffffff
 TRACE: 2 0dffda42 mangle:EGRESSGATEWAY-REPLY-ROUTING:rule:0x22e:CONTINUE  -4 -t mangle -A EGRESSGATEWAY-REPLY-ROUTING -m comment --comment "egw:e_DPYmSrjODDpMOg" -m comment --comment "label for restoring connections, rule is from the EgressGateway" -m conntrack --ctdir REPLY -j CONNMARK --restore-mark --nfmask 0xffffffff --ctmask 0xffffffff
 TRACE: 2 0dffda42 mangle:PREROUTING:rule:0xd4:ACCEPT  -4 -t mangle -A PREROUTING -m comment --comment "egw:20t7-AOmvc7_sCzR" -m comment --comment "EgressGateway reply datapath rule, rule is from the EgressGateway" -m mark --mark 0x26000000/0xff000000 -j ACCEPT
PACKET: 2 0dffda42 IN=egress.vxlan MACSRC=66:55:1d:cd:ae:d8 MACDST=66:87:86:d1:81:b MACPROTO=0800 SRC=10.111.115.95 DST=172.18.9.26 LEN=60 TOS=0x0 TTL=63 ID=9459 DF SPORT=53150 DPORT=443 SYN MARK=0x26000000
 TRACE: 2 0dffda42 nat:PREROUTING:rule:0x6399:ACCEPT  -4 -t nat -A PREROUTING -m comment --comment "egw:bx14gEwdI2z4JR7V" -m comment --comment "EgressGateway traffic accept datapath rule" -m mark --mark 0x26000000/0xff000000 -j ACCEPT
PACKET: 2 b22d3e98 IN=egress.vxlan MACSRC=66:55:1d:cd:ae:d8 MACDST=66:87:86:d1:81:b MACPROTO=0800 SRC=10.111.115.95 DST=172.18.9.26 LEN=60 TOS=0x0 TTL=63 ID=9460 DF SPORT=53150 DPORT=443 SYN
 TRACE: 2 b22d3e98 raw:PREROUTING:rule:0x1b:CONTINUE  -4 -t raw -A PREROUTING -d 172.18.9.26/32 -j TRACE
 TRACE: 2 b22d3e98 raw:PREROUTING:rule:0x18:JUMP:cali-PREROUTING  -4 -t raw -A PREROUTING -m comment --comment "cali:6gwbT8clXdHdC1b1" -j cali-PREROUTING
 TRACE: 2 b22d3e98 raw:cali-PREROUTING:rule:0x9:CONTINUE  -4 -t raw -A cali-PREROUTING -m comment --comment "cali:XFX5xbM8B9qR10JG" -j MARK --set-xmark 0x0/0xf0000
 TRACE: 2 b22d3e98 raw:cali-PREROUTING:rule:0xd:JUMP:cali-from-host-endpoint  -4 -t raw -A cali-PREROUTING -m comment --comment "cali:ImU0-4Rl2WoOI9Ou" -m mark --mark 0x0/0x40000 -j cali-from-host-endpoint
 TRACE: 2 b22d3e98 raw:cali-PREROUTING:rule:0xe:CONTINUE  -4 -t raw -A cali-PREROUTING -m comment --comment "cali:lV4V2MPoMBf0hl9T" -m mark --mark 0x10000/0x10000 -j ACCEPT
 TRACE: 2 b22d3e98 raw:PREROUTING:policy:ACCEPT
PACKET: 2 b22d3e98 IN=egress.vxlan MACSRC=66:55:1d:cd:ae:d8 MACDST=66:87:86:d1:81:b MACPROTO=0800 SRC=10.111.115.95 DST=172.18.9.26 LEN=60 TOS=0x0 TTL=63 ID=9460 DF SPORT=53150 DPORT=443 SYN
 TRACE: 2 b22d3e98 mangle:PREROUTING:rule:0xd6:JUMP:EGRESSGATEWAY-MARK-REQUEST  -4 -t mangle -A PREROUTING -m comment --comment "egw:Lh98b3mb9WlZrgw7" -m comment --comment "Checking for EgressPolicy matched traffic" -j EGRESSGATEWAY-MARK-REQUEST
 TRACE: 2 b22d3e98 mangle:PREROUTING:rule:0xd5:JUMP:EGRESSGATEWAY-REPLY-ROUTING  -4 -t mangle -A PREROUTING -m comment --comment "egw:T0xtgSfAE9gtzdEV" -m comment --comment "EgressGateway reply datapath rule, rule is from the EgressGateway" -j EGRESSGATEWAY-REPLY-ROUTING
 TRACE: 2 b22d3e98 mangle:EGRESSGATEWAY-REPLY-ROUTING:rule:0x22b:CONTINUE  -4 -t mangle -A EGRESSGATEWAY-REPLY-ROUTING -i egress.vxlan -m comment --comment "egw:y3lxUQXpSCdpPYXj" -m comment --comment "Mark the traffic from the EgressGateway tunnel, rule is from the EgressGateway" -m mac --mac-source 66:55:1d:cd:ae:d8 -m conntrack --ctdir ORIGINAL -j MARK --set-xmark 0x26e68522/0xffffffff
 TRACE: 2 b22d3e98 mangle:EGRESSGATEWAY-REPLY-ROUTING:rule:0x22c:CONTINUE  -4 -t mangle -A EGRESSGATEWAY-REPLY-ROUTING -m comment --comment "egw:BJ7f2_6mtiX56k6p" -m comment --comment "Save mark to the connection, rule is from the EgressGateway" -m mark --mark 0x26e68522 -j CONNMARK --save-mark --nfmask 0xffffffff --ctmask 0xffffffff
 TRACE: 2 b22d3e98 mangle:EGRESSGATEWAY-REPLY-ROUTING:rule:0x22d:CONTINUE  -4 -t mangle -A EGRESSGATEWAY-REPLY-ROUTING -i egress.vxlan -m comment --comment "egw:U4xgZRmrG3QOoLe0" -m comment --comment "Clear Mark of the inner package, rule is from the EgressGateway" -m mac --mac-source 66:55:1d:cd:ae:d8 -j MARK --set-xmark 0x26000000/0xffffffff
 TRACE: 2 b22d3e98 mangle:EGRESSGATEWAY-REPLY-ROUTING:rule:0x22e:CONTINUE  -4 -t mangle -A EGRESSGATEWAY-REPLY-ROUTING -m comment --comment "egw:e_DPYmSrjODDpMOg" -m comment --comment "label for restoring connections, rule is from the EgressGateway" -m conntrack --ctdir REPLY -j CONNMARK --restore-mark --nfmask 0xffffffff --ctmask 0xffffffff
 TRACE: 2 b22d3e98 mangle:PREROUTING:rule:0xd4:ACCEPT  -4 -t mangle -A PREROUTING -m comment --comment "egw:20t7-AOmvc7_sCzR" -m comment --comment "EgressGateway reply datapath rule, rule is from the EgressGateway" -m mark --mark 0x26000000/0xff000000 -j ACCEPT
PACKET: 2 b22d3e98 IN=egress.vxlan MACSRC=66:55:1d:cd:ae:d8 MACDST=66:87:86:d1:81:b MACPROTO=0800 SRC=10.111.115.95 DST=172.18.9.26 LEN=60 TOS=0x0 TTL=63 ID=9460 DF SPORT=53150 DPORT=443 SYN MARK=0x26000000
 TRACE: 2 b22d3e98 nat:PREROUTING:rule:0x6399:ACCEPT  -4 -t nat -A PREROUTING -m comment --comment "egw:bx14gEwdI2z4JR7V" -m comment --comment "EgressGateway traffic accept datapath rule" -m mark --mark 0x26000000/0xff000000 -j ACCEPT
PACKET: 2 825d80ee IN=egress.vxlan MACSRC=66:55:1d:cd:ae:d8 MACDST=66:87:86:d1:81:b MACPROTO=0800 SRC=10.111.115.95 DST=172.18.9.26 LEN=60 TOS=0x0 TTL=63 ID=9461 DF SPORT=53150 DPORT=443 SYN
 TRACE: 2 825d80ee raw:PREROUTING:rule:0x1b:CONTINUE  -4 -t raw -A PREROUTING -d 172.18.9.26/32 -j TRACE
 TRACE: 2 825d80ee raw:PREROUTING:rule:0x18:JUMP:cali-PREROUTING  -4 -t raw -A PREROUTING -m comment --comment "cali:6gwbT8clXdHdC1b1" -j cali-PREROUTING
 TRACE: 2 825d80ee raw:cali-PREROUTING:rule:0x9:CONTINUE  -4 -t raw -A cali-PREROUTING -m comment --comment "cali:XFX5xbM8B9qR10JG" -j MARK --set-xmark 0x0/0xf0000
 TRACE: 2 825d80ee raw:cali-PREROUTING:rule:0xd:JUMP:cali-from-host-endpoint  -4 -t raw -A cali-PREROUTING -m comment --comment "cali:ImU0-4Rl2WoOI9Ou" -m mark --mark 0x0/0x40000 -j cali-from-host-endpoint
 TRACE: 2 825d80ee raw:cali-PREROUTING:rule:0xe:CONTINUE  -4 -t raw -A cali-PREROUTING -m comment --comment "cali:lV4V2MPoMBf0hl9T" -m mark --mark 0x10000/0x10000 -j ACCEPT
 TRACE: 2 825d80ee raw:PREROUTING:policy:ACCEPT
PACKET: 2 825d80ee IN=egress.vxlan MACSRC=66:55:1d:cd:ae:d8 MACDST=66:87:86:d1:81:b MACPROTO=0800 SRC=10.111.115.95 DST=172.18.9.26 LEN=60 TOS=0x0 TTL=63 ID=9461 DF SPORT=53150 DPORT=443 SYN
 TRACE: 2 825d80ee mangle:PREROUTING:rule:0xd6:JUMP:EGRESSGATEWAY-MARK-REQUEST  -4 -t mangle -A PREROUTING -m comment --comment "egw:Lh98b3mb9WlZrgw7" -m comment --comment "Checking for EgressPolicy matched traffic" -j EGRESSGATEWAY-MARK-REQUEST
 TRACE: 2 825d80ee mangle:PREROUTING:rule:0xd5:JUMP:EGRESSGATEWAY-REPLY-ROUTING  -4 -t mangle -A PREROUTING -m comment --comment "egw:T0xtgSfAE9gtzdEV" -m comment --comment "EgressGateway reply datapath rule, rule is from the EgressGateway" -j EGRESSGATEWAY-REPLY-ROUTING
 TRACE: 2 825d80ee mangle:EGRESSGATEWAY-REPLY-ROUTING:rule:0x22b:CONTINUE  -4 -t mangle -A EGRESSGATEWAY-REPLY-ROUTING -i egress.vxlan -m comment --comment "egw:y3lxUQXpSCdpPYXj" -m comment --comment "Mark the traffic from the EgressGateway tunnel, rule is from the EgressGateway" -m mac --mac-source 66:55:1d:cd:ae:d8 -m conntrack --ctdir ORIGINAL -j MARK --set-xmark 0x26e68522/0xffffffff
 TRACE: 2 825d80ee mangle:EGRESSGATEWAY-REPLY-ROUTING:rule:0x22c:CONTINUE  -4 -t mangle -A EGRESSGATEWAY-REPLY-ROUTING -m comment --comment "egw:BJ7f2_6mtiX56k6p" -m comment --comment "Save mark to the connection, rule is from the EgressGateway" -m mark --mark 0x26e68522 -j CONNMARK --save-mark --nfmask 0xffffffff --ctmask 0xffffffff
 TRACE: 2 825d80ee mangle:EGRESSGATEWAY-REPLY-ROUTING:rule:0x22d:CONTINUE  -4 -t mangle -A EGRESSGATEWAY-REPLY-ROUTING -i egress.vxlan -m comment --comment "egw:U4xgZRmrG3QOoLe0" -m comment --comment "Clear Mark of the inner package, rule is from the EgressGateway" -m mac --mac-source 66:55:1d:cd:ae:d8 -j MARK --set-xmark 0x26000000/0xffffffff
 TRACE: 2 825d80ee mangle:EGRESSGATEWAY-REPLY-ROUTING:rule:0x22e:CONTINUE  -4 -t mangle -A EGRESSGATEWAY-REPLY-ROUTING -m comment --comment "egw:e_DPYmSrjODDpMOg" -m comment --comment "label for restoring connections, rule is from the EgressGateway" -m conntrack --ctdir REPLY -j CONNMARK --restore-mark --nfmask 0xffffffff --ctmask 0xffffffff
 TRACE: 2 825d80ee mangle:PREROUTING:rule:0xd4:ACCEPT  -4 -t mangle -A PREROUTING -m comment --comment "egw:20t7-AOmvc7_sCzR" -m comment --comment "EgressGateway reply datapath rule, rule is from the EgressGateway" -m mark --mark 0x26000000/0xff000000 -j ACCEPT
PACKET: 2 825d80ee IN=egress.vxlan MACSRC=66:55:1d:cd:ae:d8 MACDST=66:87:86:d1:81:b MACPROTO=0800 SRC=10.111.115.95 DST=172.18.9.26 LEN=60 TOS=0x0 TTL=63 ID=9461 DF SPORT=53150 DPORT=443 SYN MARK=0x26000000
 TRACE: 2 825d80ee nat:PREROUTING:rule:0x6399:ACCEPT  -4 -t nat -A PREROUTING -m comment --comment "egw:bx14gEwdI2z4JR7V" -m comment --comment "EgressGateway traffic accept datapath rule" -m mark --mark 0x26000000/0xff000000 -j ACCEPT
```

**Comment by Ssshafi** [comment]
Ok I found a solution but I don't know if this is a good solution...
With "net.ipv4.conf.egress/vxlan.rp_filter = 2" on my worker 2 (EIP node) : Traffic from Pod to Target is OK.
Then I need to set "net.ipv4.conf.egress/vxlan.rp_filter = 2" on my worker 1 (Pod Node) to have return traffic OK too.

So, in order to make egress gateway working, I need to set "net.ipv4.conf.egress/vxlan.rp_filter = 2" on all my pods and egress gateway nodes.

Is it OK to let rp_filter like this ?

**Comment by Ssshafi** [comment]
Ok, good to know and thank you for the PR.
