### ISSUE TITLE
Great, but I didn’t deploy successfully

### ISSUE THREAD

**Issue by GounGG** [spidernet-io/egressgateway#1581]
**Describe the version**
egressgateway 0.6.0
Kubernetes  1.22
Kernel 3.10.0-1160.83.1.el7.x86_64

**Describe the bug**
After the network packet reaches the egress gateway node, the tcp packet can only be captured on the egress.vxlan network card, but cannot be captured on the intranet network card of the gateway.
It feels like the iptable net rules are not matching.
```bash
$ iptables -t nat -L EGRESSGATEWAY-SNAT-EIP
Chain EGRESSGATEWAY-SNAT-EIP (1 references)
target     prot opt source               destination         
SNAT       all  --  anywhere             anywhere             /* egw:V9Ba0h-LO-2cnVcY */ /* snat policy default-test */ match-set egress-src-v4-738bb014438bdbfe7 src ! match-set egress-cluster-cidr-ipv4 dst ctdir ORIGINAL to:10.197.76.25
```

**Screenshots and log**
```bash
$ tcpdump -i egress.vxlan host 8.8.8.8
tcpdump: verbose output suppressed, use -v or -vv for full protocol decode
listening on egress.vxlan, link-type EN10MB (Ethernet), capture size 262144 bytes
17:54:02.606377 IP 10.244.3.17 > dns.google: ICMP echo request, id 1202, seq 62, length 64
17:54:03.606468 IP 10.244.3.17 > dns.google: ICMP echo request, id 1202, seq 63, length 64
17:54:04.606554 IP 10.244.3.17 > dns.google: ICMP echo request, id 1202, seq 64, length 64

# lan network device
$ tcpdump -i bond0 host 8.8.8.8 -n
tcpdump: verbose output suppressed, use -v or -vv for full protocol decode
```

**value.yaml**
```yaml
feature:
  tunnelIpv4Subnet: "192.200.0.0/16"
  tunnelDetectMethod: "interface=bond0"
  gatewayFailover:
    enable: true
  datapathMode: "iptables"

controller:
  replicas: 2
```

**Comment by lou-lan** [comment]
The issue has had no feedback for a long time, so it will be temporarily closed. If you encounter any problems, please feel free to reopen it. You can also try the new v0.6.7 version — we’ve fixed several recently discovered issues (including the one caused by rp_filter).
