### ISSUE TITLE
EgressGateway REPLY-ROUTING rules fail to match traffic from VXLAN tunnel due to MAC address mismatch

### ISSUE THREAD

**Issue by huizsh** [spidernet-io/egressgateway#1863]
## Description

We have egress issue with pod running in worker02 going through egress node worker01.

When traffic is sent from a Pod on a non-egress-gateway node (worker02) through the egressgateway VXLAN tunnel to the egress gateway node (worker01), the `EGRESSGATEWAY-REPLY-ROUTING` rules fail to match the traffic, preventing proper SNAT and egress functionality.

## Problem

The `buildPreroutingReplyRouting` function in `pkg/agent/police.go` creates iptables rules that match traffic based on:
1. Input interface: `egress.vxlan`
2. Source MAC address: The MAC address of the remote node (e.g., `66:9c:aa:94:fc:51` for worker02)
3. Connection direction: `ctdir ORIGINAL`

However, after VXLAN decapsulation, the inner packet's source MAC address is the Pod's MAC address, not the remote node's MAC address. This causes the rules to never match, even though:
- VXLAN encapsulated traffic (UDP port 7789) successfully arrives at the physical interface
- VXLAN decapsulation works correctly (egress.vxlan interface shows RX traffic)
- Traffic enters the `EGRESSGATEWAY-REPLY-ROUTING` chain (chain counters show traffic)

## Steps to Reproduce

1. Deploy a Pod on a non-egress-gateway node (worker02)
2. Create an EgressPolicy that routes traffic through an egress gateway node (worker01)
3. Send egress traffic from the Pod (e.g., `wget http://google.com`)
4. Check iptables rules on worker01:
   ```bash
   iptables -t mangle -nvL EGRESSGATEWAY-REPLY-ROUTING | grep <worker02-mac>
   ```
5. Observe that rule counters remain at `0 0`

## Expected Behavior

- VXLAN encapsulated traffic arrives at worker01
- After decapsulation, traffic from `egress.vxlan` interface should match the REPLY-ROUTING rules
- Rules should set the appropriate mark (`0x26ae25c1` for worker02)
- Traffic should be properly SNAT'd using the Egress IP

## Actual Behavior

- ✅ VXLAN encapsulated traffic (UDP port 7789) arrives at `bond0.3002` interface
- ✅ VXLAN decapsulation works: `egress.vxlan` interface shows RX traffic (2108 packets, 126480 bytes)
- ✅ Traffic enters `EGRESSGATEWAY-REPLY-ROUTING` chain (25244 packets, 33M bytes)
- ❌ Rules matching worker02 MAC address (`66:9c:aa:94:fc:51`) have zero counters
- ❌ SNAT rules fail to match (counter remains at `0 0`)
- ❌ Traffic cannot be properly SNAT'd

## Root Cause

The issue is in `pkg/agent/police.go:898`:

```go
Match: iptables.MatchCriteria{}.InInterface(vxlanName).SrcMacSource(mac).CTDirectionOriginal(iptables.DirectionOriginal),
```

The `SrcMacSource(mac)` matches the **inner packet's source MAC address** after VXLAN decapsulation, which is the Pod's MAC address, not the remote node's MAC address that was in the outer VXLAN header.

### VXLAN Traffic Arrives
```bash
# On worker01, UDP port 7789 traffic arrives:
[1755622.415559] VXLAN-7789-RX: IN=bond0.3002 ... SRC=10.239.17.10 DST=10.239.17.15 ... PROTO=UDP SPT=49523 DPT=7789
```

### VXLAN Decapsulation Works
```bash
# egress.vxlan interface shows RX traffic:
RX: 126480 bytes 2108 packets errors dropped missed mcast
```

### REPLY-ROUTING Chain Has Traffic
```bash
# Chain counters show traffic:
25244   33M EGRESSGATEWAY-REPLY-ROUTING  all  --  *      *       0.0.0.0/0            0.0.0.0/0
```

### Rules Don't Match
```bash
# Rules for worker02 MAC address have zero counters:
    0     0 MARK  all  --  egress.vxlan *  0.0.0.0/0  0.0.0.0/0  MAC66:9c:aa:94:fc:51 ctdir ORIGINAL MARK set 0x26ae25c1
```

### SNAT Rules Don't Match
```bash
# SNAT rule counter remains at zero:
    0     0 SNAT  all  --  *  *  0.0.0.0/0  0.0.0.0/0  match-set egress-src-v4-xxx src ! match-set egress-cluster-cidr-ipv4 dst ctdir ORIGINAL to:10.239.22.90
```

## Environment

- **Kubernetes Version**: (v1.29.12+rke2r1)
- **CNI**: Calico
- **EgressGateway Version**: (egressgateway-0.6.3)
- **Node Configuration**:
  - worker02: Pod node (non-egress-gateway)
  - worker01: Egress gateway node
- **VXLAN Configuration**:
  - VNI: 100
  - Port: 7789
  - Interface: egress.vxlan

### Configuration Details

- FDB table is correctly configured: `66:9c:aa:94:fc:51 dst 10.239.17.10 self permanent`
- Neighbor table is correct: `10.120.210.146 lladdr 66:9c:aa:94:fc:51 PERMANENT`
- VXLAN interface configuration: `vxlan id 100 local 10.239.17.15 dev bond0.3002 ... dstport 7789 nolearning`

### Related Code

- `pkg/agent/police.go:891-919` - `buildPreroutingReplyRouting` function
- The function creates rules that match based on source MAC address, which doesn't work for VXLAN decapsulated traffic

## Possible Solutions by AI

1. **Use source IP address instead of MAC address**: Match based on the source IP address of the inner packet (Pod IP) instead of MAC address
2. **Use connection mark from previous rules**: If traffic was marked on worker02, use CONNMARK to restore the mark
3. **Match based on VXLAN metadata**: Use iptables extensions that can match VXLAN metadata if available
4. **Remove MAC address requirement**: Since traffic is already on the `egress.vxlan` interface, the MAC address check might be redundant

## Impact

- **Severity**: High
- **Affected Features**: Egress traffic routing through egress gateway nodes
- **Workaround**: None identified yet

**Comment by lou-lan** [comment]
Please use `v0.6.7`, and try again, this vesion have been fix some bugs.

Please show the fellow output in you cluster:

Run on k8s master:
```shell 
kubectl get node -o wide 
kubectl get egt
kubectl get pod -A -o wide | grep 'You test pod'

kubectl get egw
kubectl get egw -o yaml

kubectl get egp -A
kubectl get egp -o yaml
```


Run on worker1
```
iptables-save 

ipset list # need install ipset cmd on you node

ip a
```

Run on worker2
```
iptables-save 

ipset list # need install ipset cmd on you node

ip a
```

**Comment by huizsh** [comment]
```
root@ce-worker01:~# ip a
1: lo: <LOOPBACK,UP,LOWER_UP> mtu 65536 qdisc noqueue state UNKNOWN group default qlen 1000
    link/loopback 00:00:00:00:00:00 brd 00:00:00:00:00:00
    inet 127.0.0.1/8 scope host lo
       valid_lft forever preferred_lft forever
    inet6 ::1/128 scope host
       valid_lft forever preferred_lft forever
2: eno1: <BROADCAST,MULTICAST,UP,LOWER_UP> mtu 9000 qdisc mq state UP group default qlen 1000
    link/ether 10:ff:e0:39:9d:10 brd ff:ff:ff:ff:ff:ff
    altname enp3s0f0
    inet6 fe80::12ff:e0ff:fe39:9d10/64 scope link
       valid_lft forever preferred_lft forever
3: eno2: <BROADCAST,MULTICAST> mtu 1500 qdisc noop state DOWN group default qlen 1000
    link/ether 10:ff:e0:39:9d:11 brd ff:ff:ff:ff:ff:ff
    altname enp3s0f1
4: ens11f0np0: <BROADCAST,MULTICAST,SLAVE,UP,LOWER_UP> mtu 9000 qdisc mq master bond0 state UP group default qlen 1000
    link/ether da:4e:be:ed:bc:9a brd ff:ff:ff:ff:ff:ff permaddr 5c:25:73:d5:96:1c
    altname enp103s0f0np0
5: ens11f1np1: <BROADCAST,MULTICAST,SLAVE,UP,LOWER_UP> mtu 9000 qdisc mq master bond0 state UP group default qlen 1000
    link/ether da:4e:be:ed:bc:9a brd ff:ff:ff:ff:ff:ff permaddr 5c:25:73:d5:96:1d
    altname enp103s0f1np1
6: ibs3: <BROADCAST,MULTICAST,UP,LOWER_UP> mtu 4092 qdisc mq state UP group default qlen 1000
    link/infiniband 00:00:10:47:fe:80:00:00:00:00:00:00:5c:25:73:03:00:ab:d5:8c brd 00:ff:ff:ff:ff:12:40:1b:ff:ff:00:00:00:00:00:00:ff:ff:ff:ff
    altname ibp9s0
    inet6 fe80::5e25:7303:ab:d58c/64 scope link
       valid_lft forever preferred_lft forever
7: ibs2: <BROADCAST,MULTICAST,UP,LOWER_UP> mtu 4092 qdisc mq state UP group default qlen 1000
    link/infiniband 00:00:10:47:fe:80:00:00:00:00:00:00:5c:25:73:03:00:ab:d9:2c brd 00:ff:ff:ff:ff:12:40:1b:ff:ff:00:00:00:00:00:00:ff:ff:ff:ff
    altname ibp23s0
    inet6 fe80::5e25:7303:ab:d92c/64 scope link
       valid_lft forever preferred_lft forever
8: ibs4: <BROADCAST,MULTICAST,UP,LOWER_UP> mtu 4092 qdisc mq state UP group default qlen 1000
    link/infiniband 00:00:10:47:fe:80:00:00:00:00:00:00:5c:25:73:03:00:ab:a4:b4 brd 00:ff:ff:ff:ff:12:40:1b:ff:ff:00:00:00:00:00:00:ff:ff:ff:ff
    altname ibp58s0
    inet6 fe80::5e25:7303:ab:a4b4/64 scope link
       valid_lft forever preferred_lft forever
9: ibs1: <BROADCAST,MULTICAST,UP,LOWER_UP> mtu 4092 qdisc mq state UP group default qlen 1000
    link/infiniband 00:00:10:47:fe:80:00:00:00:00:00:00:5c:25:73:03:00:ab:a1:6c brd 00:ff:ff:ff:ff:12:40:1b:ff:ff:00:00:00:00:00:00:ff:ff:ff:ff
    altname ibp67s0
    inet6 fe80::5e25:7303:ab:a16c/64 scope link
       valid_lft forever preferred_lft forever
10: ibs8: <BROADCAST,MULTICAST,UP,LOWER_UP> mtu 4092 qdisc mq state UP group default qlen 1000
    link/infiniband 00:00:10:47:fe:80:00:00:00:00:00:00:5c:25:73:03:00:ab:e8:94 brd 00:ff:ff:ff:ff:12:40:1b:ff:ff:00:00:00:00:00:00:ff:ff:ff:ff
    altname ibp134s0
    inet6 fe80::5e25:7303:ab:e894/64 scope link
       valid_lft forever preferred_lft forever
11: ibs7: <BROADCAST,MULTICAST,UP,LOWER_UP> mtu 4092 qdisc mq state UP group default qlen 1000
    link/infiniband 00:00:10:47:fe:80:00:00:00:00:00:00:5c:25:73:03:00:ab:f1:54 brd 00:ff:ff:ff:ff:12:40:1b:ff:ff:00:00:00:00:00:00:ff:ff:ff:ff
    altname ibp143s0
    inet6 fe80::5e25:7303:ab:f154/64 scope link
       valid_lft forever preferred_lft forever
12: ibs6: <BROADCAST,MULTICAST,UP,LOWER_UP> mtu 4092 qdisc mq state UP group default qlen 1000
    link/infiniband 00:00:10:47:fe:80:00:00:00:00:00:00:5c:25:73:03:00:ab:dc:94 brd 00:ff:ff:ff:ff:12:40:1b:ff:ff:00:00:00:00:00:00:ff:ff:ff:ff
    altname ibp183s0
    inet6 fe80::5e25:7303:ab:dc94/64 scope link
       valid_lft forever preferred_lft forever
13: ibs5: <BROADCAST,MULTICAST,UP,LOWER_UP> mtu 4092 qdisc mq state UP group default qlen 1000
    link/infiniband 00:00:10:47:fe:80:00:00:00:00:00:00:5c:25:73:03:00:ab:f0:e4 brd 00:ff:ff:ff:ff:12:40:1b:ff:ff:00:00:00:00:00:00:ff:ff:ff:ff
    altname ibp192s0
    inet6 fe80::5e25:7303:ab:f0e4/64 scope link
       valid_lft forever preferred_lft forever
14: bond0: <BROADCAST,MULTICAST,MASTER,UP,LOWER_UP> mtu 9000 qdisc noqueue state UP group default qlen 1000
    link/ether da:4e:be:ed:bc:9a brd ff:ff:ff:ff:ff:ff
    inet6 fe80::d84e:beff:feed:bc9a/64 scope link
       valid_lft forever preferred_lft forever
15: bond0.3002@bond0: <BROADCAST,MULTICAST,UP,LOWER_UP> mtu 9000 qdisc noqueue state UP group default qlen 1000
    link/ether da:4e:be:ed:bc:9a brd ff:ff:ff:ff:ff:ff
    inet 10.239.17.15/20 brd 10.239.31.255 scope global bond0.3002
       valid_lft forever preferred_lft forever
    inet6 fe80::d84e:beff:feed:bc9a/64 scope link
       valid_lft forever preferred_lft forever
16: kube-ipvs0: <BROADCAST,NOARP> mtu 1500 qdisc noop state DOWN group default
    link/ether 9e:08:02:b7:59:e1 brd ff:ff:ff:ff:ff:ff
    inet 10.110.212.245/32 scope global kube-ipvs0
       valid_lft forever preferred_lft forever
    inet 10.110.18.58/32 scope global kube-ipvs0
       valid_lft forever preferred_lft forever
    inet 10.110.20.137/32 scope global kube-ipvs0
       valid_lft forever preferred_lft forever
    inet 10.110.176.178/32 scope global kube-ipvs0
       valid_lft forever preferred_lft forever
    inet 10.110.0.1/32 scope global kube-ipvs0
       valid_lft forever preferred_lft forever
    inet 10.110.47.126/32 scope global kube-ipvs0
       valid_lft forever preferred_lft forever
    inet 10.110.88.55/32 scope global kube-ipvs0
       valid_lft forever preferred_lft forever
    inet 10.110.127.108/32 scope global kube-ipvs0
       valid_lft forever preferred_lft forever
    inet 10.110.104.45/32 scope global kube-ipvs0
       valid_lft forever preferred_lft forever
    inet 10.110.241.78/32 scope global kube-ipvs0
       valid_lft forever preferred_lft forever
    inet 10.110.118.63/32 scope global kube-ipvs0
       valid_lft forever preferred_lft forever
    inet 10.110.0.10/32 scope global kube-ipvs0
       valid_lft forever preferred_lft forever
    inet 10.110.33.206/32 scope global kube-ipvs0
       valid_lft forever preferred_lft forever
    inet 10.110.229.171/32 scope global kube-ipvs0
       valid_lft forever preferred_lft forever
    inet 10.110.16.217/32 scope global kube-ipvs0
       valid_lft forever preferred_lft forever
    inet 10.110.40.18/32 scope global kube-ipvs0
       valid_lft forever preferred_lft forever
    inet 10.239.26.2/32 scope global kube-ipvs0
       valid_lft forever preferred_lft forever
    inet 10.239.26.4/32 scope global kube-ipvs0
       valid_lft forever preferred_lft forever
    inet 10.239.26.1/32 scope global kube-ipvs0
       valid_lft forever preferred_lft forever
17: kube-lb0: <BROADCAST,NOARP,UP,LOWER_UP> mtu 1500 qdisc noqueue state UNKNOWN group default qlen 1000
    link/ether 8e:3c:61:52:aa:3d brd ff:ff:ff:ff:ff:ff
    inet6 fe80::68df:83ff:fed2:1bb6/64 scope link
       valid_lft forever preferred_lft forever
19: calid445d8fce6f@if2: <BROADCAST,MULTICAST,UP,LOWER_UP> mtu 4042 qdisc noqueue state UP group default qlen 1000
    link/ether ee:ee:ee:ee:ee:ee brd ff:ff:ff:ff:ff:ff link-netns cni-029da8d4-715a-79b0-f9dd-6c95f6c2023d
    inet6 fe80::ecee:eeff:feee:eeee/64 scope link
       valid_lft forever preferred_lft forever
20: cali4e4bb1fca9e@if2: <BROADCAST,MULTICAST,UP,LOWER_UP> mtu 4042 qdisc noqueue state UP group default qlen 1000
    link/ether ee:ee:ee:ee:ee:ee brd ff:ff:ff:ff:ff:ff link-netns cni-ee395541-93e5-a9b2-8839-75d8beb9860b
    inet6 fe80::ecee:eeff:feee:eeee/64 scope link
       valid_lft forever preferred_lft forever
21: cali2b971c69e1b@if2: <BROADCAST,MULTICAST,UP,LOWER_UP> mtu 4042 qdisc noqueue state UP group default qlen 1000
    link/ether ee:ee:ee:ee:ee:ee brd ff:ff:ff:ff:ff:ff link-netns cni-a515824d-6418-3e38-ab93-d75b94ef61a9
    inet6 fe80::ecee:eeff:feee:eeee/64 scope link
       valid_lft forever preferred_lft forever
22: calie5bb4175daf@if2: <BROADCAST,MULTICAST,UP,LOWER_UP> mtu 4042 qdisc noqueue state UP group default qlen 1000
    link/ether ee:ee:ee:ee:ee:ee brd ff:ff:ff:ff:ff:ff link-netns cni-c86c595e-c9fc-6f3f-4147-306ff5dc1db4
    inet6 fe80::ecee:eeff:feee:eeee/64 scope link
       valid_lft forever preferred_lft forever
23: cali3f5991b3a73@if2: <BROADCAST,MULTICAST,UP,LOWER_UP> mtu 4042 qdisc noqueue state UP group default qlen 1000
    link/ether ee:ee:ee:ee:ee:ee brd ff:ff:ff:ff:ff:ff link-netns cni-ce69c872-682e-861f-10fc-ac6f001d4248
    inet6 fe80::ecee:eeff:feee:eeee/64 scope link
       valid_lft forever preferred_lft forever
24: cali4631207b271@if2: <BROADCAST,MULTICAST,UP,LOWER_UP> mtu 4042 qdisc noqueue state UP group default qlen 1000
    link/ether ee:ee:ee:ee:ee:ee brd ff:ff:ff:ff:ff:ff link-netns cni-b466e274-8bd8-af00-70c4-a31d4e018a9e
    inet6 fe80::ecee:eeff:feee:eeee/64 scope link
       valid_lft forever preferred_lft forever
26: caliae77b679ce3@if2: <BROADCAST,MULTICAST,UP,LOWER_UP> mtu 4042 qdisc noqueue state UP group default qlen 1000
    link/ether ee:ee:ee:ee:ee:ee brd ff:ff:ff:ff:ff:ff link-netns cni-5d37ec26-cf7c-2b7f-4040-7f7cd5baf38f
    inet6 fe80::ecee:eeff:feee:eeee/64 scope link
       valid_lft forever preferred_lft forever
27: calid14a5785434@if2: <BROADCAST,MULTICAST,UP,LOWER_UP> mtu 4042 qdisc noqueue state UP group default qlen 1000
    link/ether ee:ee:ee:ee:ee:ee brd ff:ff:ff:ff:ff:ff link-netns cni-e0fb49c5-a9a5-29df-ca68-d3e0b5784c23
    inet6 fe80::ecee:eeff:feee:eeee/64 scope link
       valid_lft forever preferred_lft forever
28: egress.vxlan: <BROADCAST,MULTICAST,UP,LOWER_UP> mtu 8950 qdisc noqueue state UNKNOWN group default
    link/ether 66:20:13:91:f9:4e brd ff:ff:ff:ff:ff:ff
    inet 10.120.25.63/16 brd 10.120.255.255 scope global egress.vxlan
       valid_lft forever preferred_lft forever
    inet6 fe80::6420:13ff:fe91:f94e/64 scope link
       valid_lft forever preferred_lft forever
29: vxlan.calico: <BROADCAST,MULTICAST,UP,LOWER_UP> mtu 4042 qdisc noqueue state UNKNOWN group default qlen 1000
    link/ether 66:78:d3:86:fd:36 brd ff:ff:ff:ff:ff:ff
    inet 10.100.24.192/32 scope global vxlan.calico
       valid_lft forever preferred_lft forever
    inet6 fe80::6478:d3ff:fe86:fd36/64 scope link
       valid_lft forever preferred_lft forever
90: cali676e19a904c@if2: <BROADCAST,MULTICAST,UP,LOWER_UP> mtu 4042 qdisc noqueue state UP group default qlen 1000
    link/ether ee:ee:ee:ee:ee:ee brd ff:ff:ff:ff:ff:ff link-netns cni-db406bdc-d962-5398-9c72-153637eff784
    inet6 fe80::ecee:eeff:feee:eeee/64 scope link
       valid_lft forever preferred_lft forever
139: calidea98f5ac75@if2: <BROADCAST,MULTICAST,UP,LOWER_UP> mtu 4042 qdisc noqueue state UP group default qlen 1000
    link/ether ee:ee:ee:ee:ee:ee brd ff:ff:ff:ff:ff:ff link-netns cni-05437793-45ab-2083-2bc6-ebecaf074c8b
    inet6 fe80::ecee:eeff:feee:eeee/64 scope link
       valid_lft forever preferred_lft forever
142: califa4757aa13b@if2: <BROADCAST,MULTICAST,UP,LOWER_UP> mtu 4042 qdisc noqueue state UP group default qlen 1000
    link/ether ee:ee:ee:ee:ee:ee brd ff:ff:ff:ff:ff:ff link-netns cni-c18b81f4-74f5-0c69-5f58-2401bc37479b
    inet6 fe80::ecee:eeff:feee:eeee/64 scope link
       valid_lft forever preferred_lft forever
146: cali4b6f4fcd6bd@if2: <BROADCAST,MULTICAST,UP,LOWER_UP> mtu 4042 qdisc noqueue state UP group default qlen 1000
    link/ether ee:ee:ee:ee:ee:ee brd ff:ff:ff:ff:ff:ff link-netns cni-6d97ad39-a1ed-bd74-b039-6f8de9133c02
    inet6 fe80::ecee:eeff:feee:eeee/64 scope link
       valid_lft forever preferred_lft forever
147: cali5e366807b71@if2: <BROADCAST,MULTICAST,UP,LOWER_UP> mtu 4042 qdisc noqueue state UP group default qlen 1000
    link/ether ee:ee:ee:ee:ee:ee brd ff:ff:ff:ff:ff:ff link-netns cni-b9be8e2e-8ca2-4e4f-8f10-9d15ecce63e0
    inet6 fe80::ecee:eeff:feee:eeee/64 scope link
       valid_lft forever preferred_lft forever
```

**Comment by huizsh** [comment]
```
root@ce-worker02-den1-pro1-gpu-0010:~# iptables-save
# Generated by iptables-save v1.8.7 on Wed Nov 12 08:25:12 2025
*mangle
:PREROUTING ACCEPT [0:0]
:INPUT ACCEPT [0:0]
:FORWARD ACCEPT [0:0]
:OUTPUT ACCEPT [0:0]
:POSTROUTING ACCEPT [0:0]
:EGRESSGATEWAY-MARK-REQUEST - [0:0]
:KUBE-IPTABLES-HINT - [0:0]
:KUBE-KUBELET-CANARY - [0:0]
:cali-POSTROUTING - [0:0]
:cali-PREROUTING - [0:0]
:cali-from-host-endpoint - [0:0]
:cali-to-host-endpoint - [0:0]
-A PREROUTING -m comment --comment "egw:Lh98b3mb9WlZrgw7" -m comment --comment "Checking for EgressPolicy matched traffic" -j EGRESSGATEWAY-MARK-REQUEST
-A PREROUTING -m comment --comment "egw:4vaggeYl6c-Gn0Yv" -m comment --comment "EgressGateway traffic accept datapath rule" -j ACCEPT
-A PREROUTING -m comment --comment "cali:6gwbT8clXdHdC1b1" -j cali-PREROUTING
-A FORWARD -m comment --comment "egw:QZatZARIgegXh8rb" -m comment --comment "Accept for egress traffic from pod going to EgressTunnel" -m mark --mark 0x26000000/0xff000000 -j MARK --set-xmark 0x26000000/0xffffffff
-A POSTROUTING -m comment --comment "egw:ymEAarDWTR9SHgDS" -m comment --comment "Accept for egress traffic from pod going to EgressTunnel" -j ACCEPT
-A POSTROUTING -m comment --comment "cali:O3lYWMrLQYEMJtB5" -j cali-POSTROUTING
-A EGRESSGATEWAY-MARK-REQUEST -m comment --comment "egw:mnk079efVjaQAYrs" -m comment --comment "Set mark for EgressPolicy ce-tenant-d1bd701d-0c6b-4d77-8e53-8abdf06e116d-341e7ce1-47a8-49d0-be3d-3f796e12da7a" -m set --match-set egress-src-v4-ac785602741f1595f src -m set ! --match-set egress-cluster-cidr-ipv4 dst -m conntrack --ctdir ORIGINAL -j MARK --set-xmark 0x26970aef/0xffffffff
-A EGRESSGATEWAY-MARK-REQUEST -m comment --comment "egw:E90HrkGZerRiP11U" -m comment --comment "Set mark for EgressPolicy ce-tenant-26af4144-6fa7-4d55-ad08-cbabc2045069-7e7c6969-67cd-4cf1-a831-b934c3c71bc7" -m set --match-set egress-src-v4-f66a192709a4d4ba0 src -m set ! --match-set egress-cluster-cidr-ipv4 dst -m conntrack --ctdir ORIGINAL -j MARK --set-xmark 0x26970aef/0xffffffff
-A EGRESSGATEWAY-MARK-REQUEST -m comment --comment "egw:wOPqtn6CK6SY48SV" -m comment --comment "Set mark for EgressPolicy ce-tenant-384eac17-f1e2-420e-8e12-38881164ce07-5b72a42e-5e68-4a5c-90f5-770b0fa89c48" -m set --match-set egress-src-v4-3eef5ee05d39eb762 src -m set ! --match-set egress-cluster-cidr-ipv4 dst -m conntrack --ctdir ORIGINAL -j MARK --set-xmark 0x26970aef/0xffffffff
-A EGRESSGATEWAY-MARK-REQUEST -m comment --comment "egw:B4yVKnaY6GrKk4uv" -m comment --comment "Set mark for EgressPolicy default-test" -m set --match-set egress-src-v4-738bb014438bdbfe7 src -m set ! --match-set egress-cluster-cidr-ipv4 dst -m conntrack --ctdir ORIGINAL -j MARK --set-xmark 0x26970aef/0xffffffff
-A cali-POSTROUTING -m comment --comment "cali:NX-7roTexQ3fGRfU" -j RETURN
-A cali-POSTROUTING -m comment --comment "cali:qaajsWArU1ku9saf" -j RETURN
-A cali-POSTROUTING -m comment --comment "cali:N2faOPfc4DVQAfQj" -j MARK --set-xmark 0x0/0xf0000
-A cali-POSTROUTING -m comment --comment "cali:IR1ghU6yHNWsaaJF" -m conntrack --ctstate DNAT -j cali-to-host-endpoint
-A cali-POSTROUTING -m comment --comment "cali:fcjhvOBNywbfCkS2" -m comment --comment "Host endpoint policy accepted packet." -j RETURN
-A cali-PREROUTING -m comment --comment "cali:6BJqBjBC7crtA-7-" -m conntrack --ctstate RELATED,ESTABLISHED -j ACCEPT
-A cali-PREROUTING -m comment --comment "cali:KX7AGNd6rMcDUai6" -j ACCEPT
-A cali-PREROUTING -m comment --comment "cali:wNH7KsA3ILKJBsY9" -j cali-from-host-endpoint
-A cali-PREROUTING -m comment --comment "cali:Cg96MgVuoPm7UMRo" -m comment --comment "Host endpoint policy accepted packet." -j ACCEPT
COMMIT
# Completed on Wed Nov 12 08:25:12 2025
# Generated by iptables-save v1.8.7 on Wed Nov 12 08:25:12 2025
*raw
:PREROUTING ACCEPT [0:0]
:OUTPUT ACCEPT [0:0]
:cali-OUTPUT - [0:0]
:cali-PREROUTING - [0:0]
:cali-from-host-endpoint - [0:0]
:cali-rpf-skip - [0:0]
:cali-to-host-endpoint - [0:0]
-A PREROUTING -m comment --comment "cali:6gwbT8clXdHdC1b1" -j cali-PREROUTING
-A OUTPUT -m comment --comment "cali:tVnHkvAo15HuiPy0" -j cali-OUTPUT
-A cali-OUTPUT -m comment --comment "cali:njdnLwYeGqBJyMxW" -j MARK --set-xmark 0x0/0xf0000
-A cali-OUTPUT -m comment --comment "cali:rz86uTUcEZAfFsh7" -j cali-to-host-endpoint
-A cali-OUTPUT -p udp -m comment --comment "cali:h6IBQLYf-NmXFeY_" -j NOTRACK
-A cali-OUTPUT -m comment --comment "cali:DoQ7AqyOyqExxSea" -j ACCEPT
-A cali-PREROUTING -m comment --comment "cali:XFX5xbM8B9qR10JG" -j MARK --set-xmark 0x0/0xf0000
-A cali-PREROUTING -p udp -m comment --comment "cali:M7WeklUcDzCqHKI_" -j NOTRACK
-A cali-PREROUTING -i cali+ -m comment --comment "cali:pNzLEcwGOZ4YemC-" -j MARK --set-xmark 0x40000/0x40000
-A cali-PREROUTING -m comment --comment "cali:k5-EypuOGdQbMjmG" -j cali-rpf-skip
-A cali-PREROUTING -m comment --comment "cali:ZRno2gPYKT_N2WJV" -m rpfilter --validmark --invert -j DROP
-A cali-PREROUTING -m comment --comment "cali:oBQn3t8RvFIlNu_v" -j cali-from-host-endpoint
-A cali-PREROUTING -m comment --comment "cali:lZy_EB5TkNFykbsd" -j ACCEPT
COMMIT
# Completed on Wed Nov 12 08:25:12 2025
# Generated by iptables-save v1.8.7 on Wed Nov 12 08:25:12 2025
*filter
:INPUT ACCEPT [0:0]
:FORWARD ACCEPT [0:0]
:OUTPUT ACCEPT [0:0]
:KUBE-FIREWALL - [0:0]
:KUBE-FORWARD - [0:0]
:KUBE-IPVS-FILTER - [0:0]
:KUBE-IPVS-OUT-FILTER - [0:0]
:KUBE-KUBELET-CANARY - [0:0]
:KUBE-NODE-PORT - [0:0]
:KUBE-PROXY-FIREWALL - [0:0]
:KUBE-SOURCE-RANGES-FIREWALL - [0:0]
:cali-FORWARD - [0:0]
:cali-INPUT - [0:0]
:cali-OUTPUT - [0:0]
:cali-cidr-block - [0:0]
:cali-forward-check - [0:0]
:cali-forward-endpoint-mark - [0:0]
:cali-from-endpoint-mark - [0:0]
:cali-from-hep-forward - [0:0]
:cali-from-host-endpoint - [0:0]
:cali-from-wl-dispatch - [0:0]
:cali-fw-cali01a377c2e85 - [0:0]
:cali-fw-cali4ab24bb9148 - [0:0]
:cali-fw-cali5abca9a20b8 - [0:0]
:cali-fw-cali6ff50206ec9 - [0:0]
:cali-fw-cali72199f7015c - [0:0]
:cali-fw-cali97f907a8190 - [0:0]
:cali-fw-caliadcbc557ae8 - [0:0]
:cali-fw-calic79234d36a5 - [0:0]
:cali-fw-calid2faaa3a8df - [0:0]
:cali-fw-califef0bc22feb - [0:0]
:cali-pri-_2Qe4kInhqKlw-GMehI - [0:0]
:cali-pri-_7PAcU-eJyOsb9Xu8NB - [0:0]
:cali-pri-_7sLR5_U6vUQFfeZ_3J - [0:0]
:cali-pri-_9wXc41akjYX6CbTda_ - [0:0]
:cali-pri-_Ccq2yHWYaPdurqTYKX - [0:0]
:cali-pri-_GyLFhtf5u9n-v9Ckd7 - [0:0]
:cali-pri-_TBSAk0RolsLR7gyY_U - [0:0]
:cali-pri-_YhxsgXk11JV_YlfoPn - [0:0]
:cali-pri-_jfwf7TL6GWNgbdQkTH - [0:0]
:cali-pri-_lBs4svX6CHFDB_yqJt - [0:0]
:cali-pri-kns.default - [0:0]
:cali-pri-kns.egress - [0:0]
:cali-pri-kns.kube-system - [0:0]
:cali-pri-ksa.default.default - [0:0]
:cali-pro-_2Qe4kInhqKlw-GMehI - [0:0]
:cali-pro-_7PAcU-eJyOsb9Xu8NB - [0:0]
:cali-pro-_7sLR5_U6vUQFfeZ_3J - [0:0]
:cali-pro-_9wXc41akjYX6CbTda_ - [0:0]
:cali-pro-_Ccq2yHWYaPdurqTYKX - [0:0]
:cali-pro-_GyLFhtf5u9n-v9Ckd7 - [0:0]
:cali-pro-_TBSAk0RolsLR7gyY_U - [0:0]
:cali-pro-_YhxsgXk11JV_YlfoPn - [0:0]
:cali-pro-_jfwf7TL6GWNgbdQkTH - [0:0]
:cali-pro-_lBs4svX6CHFDB_yqJt - [0:0]
:cali-pro-kns.default - [0:0]
:cali-pro-kns.egress - [0:0]
:cali-pro-kns.kube-system - [0:0]
:cali-pro-ksa.default.default - [0:0]
:cali-set-endpoint-mark - [0:0]
:cali-sm-cali01a377c2e85 - [0:0]
:cali-sm-cali4ab24bb9148 - [0:0]
:cali-sm-cali5abca9a20b8 - [0:0]
:cali-sm-cali6ff50206ec9 - [0:0]
:cali-sm-cali72199f7015c - [0:0]
:cali-sm-cali97f907a8190 - [0:0]
:cali-sm-caliadcbc557ae8 - [0:0]
:cali-sm-calic79234d36a5 - [0:0]
:cali-sm-calid2faaa3a8df - [0:0]
:cali-sm-califef0bc22feb - [0:0]
:cali-to-hep-forward - [0:0]
:cali-to-host-endpoint - [0:0]
:cali-to-wl-dispatch - [0:0]
:cali-tw-cali01a377c2e85 - [0:0]
:cali-tw-cali4ab24bb9148 - [0:0]
:cali-tw-cali5abca9a20b8 - [0:0]
:cali-tw-cali6ff50206ec9 - [0:0]
:cali-tw-cali72199f7015c - [0:0]
:cali-tw-cali97f907a8190 - [0:0]
:cali-tw-caliadcbc557ae8 - [0:0]
:cali-tw-calic79234d36a5 - [0:0]
:cali-tw-calid2faaa3a8df - [0:0]
:cali-tw-califef0bc22feb - [0:0]
:cali-wl-to-host - [0:0]
-A INPUT -m comment --comment "kubernetes ipvs access filter" -j KUBE-IPVS-FILTER
-A INPUT -m comment --comment "kube-proxy firewall rules" -j KUBE-PROXY-FIREWALL
-A INPUT -m comment --comment "kubernetes health check rules" -j KUBE-NODE-PORT
-A INPUT -j KUBE-FIREWALL
-A INPUT -m comment --comment "cali:Cz_u1IQiXIMmKD4c" -j cali-INPUT
-A FORWARD -m comment --comment "egw:k9r8D6t2n2nfb88V" -m comment --comment "Accept for egress traffic from pod going to EgressTunnel" -m mark --mark 0x26000000 -j ACCEPT
-A FORWARD -m comment --comment "kube-proxy firewall rules" -j KUBE-PROXY-FIREWALL
-A FORWARD -m comment --comment "kubernetes forwarding rules" -j KUBE-FORWARD
-A FORWARD -m comment --comment "cali:wUHhoiAYhphO9Mso" -j cali-FORWARD
-A FORWARD -m comment --comment "cali:S93hcgKJrXEqnTfs" -m comment --comment "Policy explicitly accepted packet." -j ACCEPT
-A FORWARD -m comment --comment "cali:mp77cMpurHhyjLrM" -j MARK --set-xmark 0x10000/0x10000
-A OUTPUT -m comment --comment "egw:1l0yvxSlKPV6W8en" -m comment --comment "Accept for egress traffic from pod going to EgressTunnel" -m mark --mark 0x26000000 -j ACCEPT
-A OUTPUT -m comment --comment "kubernetes ipvs access filter" -j KUBE-IPVS-OUT-FILTER
-A OUTPUT -j KUBE-FIREWALL
-A OUTPUT -m comment --comment "cali:tVnHkvAo15HuiPy0" -j cali-OUTPUT
-A KUBE-FIREWALL ! -s 127.0.0.0/8 -d 127.0.0.0/8 -m comment --comment "block incoming localnet connections" -m conntrack ! --ctstate RELATED,ESTABLISHED,DNAT -j DROP
-A KUBE-FORWARD -m comment --comment "kubernetes forwarding rules" -j ACCEPT
-A KUBE-FORWARD -m comment --comment "kubernetes forwarding conntrack rule" -m conntrack --ctstate RELATED,ESTABLISHED -j ACCEPT
-A KUBE-IPVS-FILTER -m set --match-set KUBE-LOAD-BALANCER dst,dst -j RETURN
-A KUBE-IPVS-FILTER -m set --match-set KUBE-CLUSTER-IP dst,dst -j RETURN
-A KUBE-IPVS-FILTER -m set --match-set KUBE-EXTERNAL-IP dst,dst -j RETURN
-A KUBE-IPVS-FILTER -m set --match-set KUBE-EXTERNAL-IP-LOCAL dst,dst -j RETURN
-A KUBE-IPVS-FILTER -m set --match-set KUBE-HEALTH-CHECK-NODE-PORT dst -j RETURN
-A KUBE-IPVS-FILTER -m conntrack --ctstate NEW -m set --match-set KUBE-IPVS-IPS dst -j REJECT --reject-with icmp-port-unreachable
-A KUBE-NODE-PORT -m comment --comment "Kubernetes health check node port" -m set --match-set KUBE-HEALTH-CHECK-NODE-PORT dst -j ACCEPT
-A KUBE-SOURCE-RANGES-FIREWALL -j DROP
-A cali-FORWARD -m comment --comment "cali:vjrMJCRpqwy5oRoX" -j MARK --set-xmark 0x0/0xe0000
-A cali-FORWARD -m comment --comment "cali:A_sPAO0mcxbT9mOV" -j cali-from-hep-forward
-A cali-FORWARD -i cali+ -m comment --comment "cali:8ZoYfO5HKXWbB3pk" -j cali-from-wl-dispatch
-A cali-FORWARD -o cali+ -m comment --comment "cali:jdEuaPBe14V2hutn" -j cali-to-wl-dispatch
-A cali-FORWARD -m comment --comment "cali:12bc6HljsMKsmfr-" -j cali-to-hep-forward
-A cali-FORWARD -m comment --comment "cali:NOSxoaGx8OIstr1z" -j cali-cidr-block
-A cali-INPUT -p udp -m comment --comment "cali:J76FwxInZIsk7uKY" -m comment --comment "Allow IPv4 VXLAN packets from allowed hosts" -m multiport --dports 4789 -m set --match-set cali40all-vxlan-net src -m addrtype --dst-type LOCAL -j ACCEPT
-A cali-INPUT -p udp -m comment --comment "cali:EDCNTTxYfggApx8C" -m comment --comment "Drop IPv4 VXLAN packets from non-allowed hosts" -m multiport --dports 4789 -m addrtype --dst-type LOCAL -j DROP
-A cali-INPUT -m comment --comment "cali:B_8fGLpLlTQcXZgh" -j MARK --set-xmark 0x0/0xfff00000
-A cali-INPUT -m comment --comment "cali:AD1HGbXEph59_YyS" -j cali-forward-check
-A cali-INPUT -m comment --comment "cali:NmYAbfrd1o63cxNo" -j RETURN
-A cali-INPUT -i cali+ -m comment --comment "cali:O-dDeZL8fOcsUtUD" -g cali-wl-to-host
-A cali-INPUT -m comment --comment "cali:ZI1yfOrOsD5YjTbe" -j ACCEPT
-A cali-INPUT -m comment --comment "cali:XxqbC-iTL5WaS8eO" -j MARK --set-xmark 0x0/0xf0000
-A cali-INPUT -m comment --comment "cali:IZ5RzzpDkgrPBLwh" -j cali-from-host-endpoint
-A cali-INPUT -m comment --comment "cali:jUXk5Q3mXlNarOhs" -m comment --comment "Host endpoint policy accepted packet." -j ACCEPT
-A cali-OUTPUT -m comment --comment "cali:Mq1_rAdXXH3YkrzW" -j ACCEPT
-A cali-OUTPUT -m comment --comment "cali:5Z67OUUpTOM7Xa1a" -g cali-forward-endpoint-mark
-A cali-OUTPUT -o cali+ -m comment --comment "cali:M2Wf0OehNdig8MHR" -j RETURN
-A cali-OUTPUT -p udp -m comment --comment "cali:ClE20y3NCwgoEuMI" -m comment --comment "Allow IPv4 VXLAN packets to other allowed hosts" -m multiport --dports 4789 -m addrtype --src-type LOCAL -m set --match-set cali40all-vxlan-net dst -j ACCEPT
-A cali-OUTPUT -m comment --comment "cali:aMcwcA5f79hQPBgR" -j MARK --set-xmark 0x0/0xf0000
-A cali-OUTPUT -m comment --comment "cali:n_vqcKl8u9NdpYmx" -m conntrack ! --ctstate DNAT -j cali-to-host-endpoint
-A cali-OUTPUT -m comment --comment "cali:979hsn7wL9UDIMMj" -m comment --comment "Host endpoint policy accepted packet." -j ACCEPT
-A cali-forward-check -m comment --comment "cali:Pbldlb4FaULvpdD8" -m conntrack --ctstate RELATED,ESTABLISHED -j RETURN
-A cali-forward-check -p tcp -m comment --comment "cali:ZD-6UxuUtGW-xtzg" -m comment --comment "To kubernetes NodePort service" -m multiport --dports 30000:32767 -m set --match-set cali40this-host dst -g cali-set-endpoint-mark
-A cali-forward-check -p udp -m comment --comment "cali:CbPfUajQ2bFVnDq4" -m comment --comment "To kubernetes NodePort service" -m multiport --dports 30000:32767 -m set --match-set cali40this-host dst -g cali-set-endpoint-mark
-A cali-forward-check -m comment --comment "cali:jmhU0ODogX-Zfe5g" -m comment --comment "To kubernetes service" -m set ! --match-set cali40this-host dst -j cali-set-endpoint-mark
-A cali-forward-endpoint-mark -m comment --comment "cali:O0SmFDrnm7KggWqW" -j cali-from-endpoint-mark
-A cali-forward-endpoint-mark -o cali+ -m comment --comment "cali:aFl0WFKRxDqj8oA6" -j cali-to-wl-dispatch
-A cali-forward-endpoint-mark -m comment --comment "cali:AZKVrO3i_8cLai5f" -j cali-to-hep-forward
-A cali-forward-endpoint-mark -m comment --comment "cali:96HaP1sFtb-NYoYA" -j MARK --set-xmark 0x0/0xfff00000
-A cali-forward-endpoint-mark -m comment --comment "cali:VxO6hyNWz62YEtul" -m comment --comment "Policy explicitly accepted packet." -j ACCEPT
-A cali-from-endpoint-mark -m comment --comment "cali:V8yvjJhvXWiZd1Q8" -g cali-fw-cali01a377c2e85
-A cali-from-endpoint-mark -m comment --comment "cali:FjGgB5PfYbboi-Mv" -g cali-fw-cali4ab24bb9148
-A cali-from-endpoint-mark -m comment --comment "cali:gxvR5Nzkkv6drkb6" -g cali-fw-cali5abca9a20b8
-A cali-from-endpoint-mark -m comment --comment "cali:aPrfJc4wxwqw_OLd" -g cali-fw-cali6ff50206ec9
-A cali-from-endpoint-mark -m comment --comment "cali:dUEu6y1a9EuClfh7" -g cali-fw-cali72199f7015c
-A cali-from-endpoint-mark -m comment --comment "cali:ciByFnt9s3F8-19B" -g cali-fw-cali97f907a8190
-A cali-from-endpoint-mark -m comment --comment "cali:kAmS7Pcj1Rybk7r_" -g cali-fw-caliadcbc557ae8
-A cali-from-endpoint-mark -m comment --comment "cali:xz5P0Q5VhbFdBMmm" -g cali-fw-calic79234d36a5
-A cali-from-endpoint-mark -m comment --comment "cali:ihpRUvvrT4cTvid_" -g cali-fw-calid2faaa3a8df
-A cali-from-endpoint-mark -m comment --comment "cali:G3nG4GarUZNlVy7r" -g cali-fw-califef0bc22feb
-A cali-from-endpoint-mark -m comment --comment "cali:TpEedWjHJPYJsTDH" -m comment --comment "Unknown interface" -j DROP
-A cali-from-wl-dispatch -i cali01a377c2e85 -m comment --comment "cali:Kl79JedvGuUkWQi4" -g cali-fw-cali01a377c2e85
-A cali-from-wl-dispatch -i cali4ab24bb9148 -m comment --comment "cali:s4EQ0tZfOvecKyec" -g cali-fw-cali4ab24bb9148
-A cali-from-wl-dispatch -i cali5abca9a20b8 -m comment --comment "cali:cvjfgXehEcHZ8IdW" -g cali-fw-cali5abca9a20b8
-A cali-from-wl-dispatch -i cali6ff50206ec9 -m comment --comment "cali:XweCF-utcrOI_6p2" -g cali-fw-cali6ff50206ec9
-A cali-from-wl-dispatch -i cali72199f7015c -m comment --comment "cali:89YvgC9U_Qxwnm6p" -g cali-fw-cali72199f7015c
-A cali-from-wl-dispatch -i cali97f907a8190 -m comment --comment "cali:khrzeFLR-l0LvshP" -g cali-fw-cali97f907a8190
-A cali-from-wl-dispatch -i caliadcbc557ae8 -m comment --comment "cali:euEn0D5MydQPsmoO" -g cali-fw-caliadcbc557ae8
-A cali-from-wl-dispatch -i calic79234d36a5 -m comment --comment "cali:3lsfCKOAreHdk41U" -g cali-fw-calic79234d36a5
-A cali-from-wl-dispatch -i calid2faaa3a8df -m comment --comment "cali:t2CA1N-rMfK-bRn1" -g cali-fw-calid2faaa3a8df
-A cali-from-wl-dispatch -i califef0bc22feb -m comment --comment "cali:xbjSqYGxGn4bIaNO" -g cali-fw-califef0bc22feb
-A cali-from-wl-dispatch -m comment --comment "cali:wZx5orUJOqCNoptu" -m comment --comment "Unknown interface" -j DROP
-A cali-fw-cali01a377c2e85 -m comment --comment "cali:iJUkcZqKJnl0d8OV" -m conntrack --ctstate RELATED,ESTABLISHED -j ACCEPT
-A cali-fw-cali01a377c2e85 -m comment --comment "cali:m8Mayakfj5XEr1H7" -m conntrack --ctstate INVALID -j DROP
-A cali-fw-cali01a377c2e85 -m comment --comment "cali:ywM4zSNsuZ3p0KRL" -j MARK --set-xmark 0x0/0x30000
-A cali-fw-cali01a377c2e85 -p udp -m comment --comment "cali:VKnIWuTWNV9jGaGP" -m comment --comment "Drop VXLAN encapped packets originating in workloads" -m multiport --dports 4789 -j DROP
-A cali-fw-cali01a377c2e85 -p ipencap -m comment --comment "cali:BLEzdWx-6iGXGk8U" -m comment --comment "Drop IPinIP encapped packets originating in workloads" -j DROP
-A cali-fw-cali01a377c2e85 -m comment --comment "cali:EITScbgGhPLeFd3e" -j cali-pro-_7sLR5_U6vUQFfeZ_3J
-A cali-fw-cali01a377c2e85 -m comment --comment "cali:qp0fpPuAomwlI0ao" -m comment --comment "Return if profile accepted" -j RETURN
-A cali-fw-cali01a377c2e85 -m comment --comment "cali:QFf7EIDo1lJd_n7e" -j cali-pro-_YhxsgXk11JV_YlfoPn
-A cali-fw-cali01a377c2e85 -m comment --comment "cali:9Y-fRx6vjBGLOokx" -m comment --comment "Return if profile accepted" -j RETURN
-A cali-fw-cali01a377c2e85 -m comment --comment "cali:Sps65hfi3CV09ikS" -m comment --comment "Drop if no profiles matched" -j DROP
-A cali-fw-cali4ab24bb9148 -m comment --comment "cali:vnNQAx9GFDXLjyN_" -m conntrack --ctstate RELATED,ESTABLISHED -j ACCEPT
-A cali-fw-cali4ab24bb9148 -m comment --comment "cali:7j6hCLrkP4QFLR_U" -m conntrack --ctstate INVALID -j DROP
-A cali-fw-cali4ab24bb9148 -m comment --comment "cali:B8R2dlGx1pBoMu4W" -j MARK --set-xmark 0x0/0x30000
-A cali-fw-cali4ab24bb9148 -p udp -m comment --comment "cali:yrfBdiCpGSJtjHEK" -m comment --comment "Drop VXLAN encapped packets originating in workloads" -m multiport --dports 4789 -j DROP
-A cali-fw-cali4ab24bb9148 -p ipencap -m comment --comment "cali:fg_gcnDT_kW1IURO" -m comment --comment "Drop IPinIP encapped packets originating in workloads" -j DROP
-A cali-fw-cali4ab24bb9148 -m comment --comment "cali:4bcxr9yKp99n38va" -j cali-pro-kns.default
-A cali-fw-cali4ab24bb9148 -m comment --comment "cali:BQ_Tt3oVEioNMCTl" -m comment --comment "Return if profile accepted" -j RETURN
-A cali-fw-cali4ab24bb9148 -m comment --comment "cali:64QtiDuiNpPUEi7J" -j cali-pro-ksa.default.default
-A cali-fw-cali4ab24bb9148 -m comment --comment "cali:lfHFuUGVv1rup8A4" -m comment --comment "Return if profile accepted" -j RETURN
-A cali-fw-cali4ab24bb9148 -m comment --comment "cali:RtHSdYJFH6hCtUa4" -m comment --comment "Drop if no profiles matched" -j DROP
-A cali-fw-cali5abca9a20b8 -m comment --comment "cali:A_QTwopweSFiGX9w" -m conntrack --ctstate RELATED,ESTABLISHED -j ACCEPT
-A cali-fw-cali5abca9a20b8 -m comment --comment "cali:wtlmWQkaAeMlTbmw" -m conntrack --ctstate INVALID -j DROP
-A cali-fw-cali5abca9a20b8 -m comment --comment "cali:F95JPjBSkqz-HUMe" -j MARK --set-xmark 0x0/0x30000
-A cali-fw-cali5abca9a20b8 -p udp -m comment --comment "cali:2fBJ9QsmzKR0q5nR" -m comment --comment "Drop VXLAN encapped packets originating in workloads" -m multiport --dports 4789 -j DROP
-A cali-fw-cali5abca9a20b8 -p ipencap -m comment --comment "cali:0jjALBtkZ6xj4AoW" -m comment --comment "Drop IPinIP encapped packets originating in workloads" -j DROP
-A cali-fw-cali5abca9a20b8 -m comment --comment "cali:RCItD12rKr8Cil8X" -j cali-pro-_7sLR5_U6vUQFfeZ_3J
-A cali-fw-cali5abca9a20b8 -m comment --comment "cali:vHpTq_5pEljKehaQ" -m comment --comment "Return if profile accepted" -j RETURN
-A cali-fw-cali5abca9a20b8 -m comment --comment "cali:djcjvhMtVIZVw5FB" -j cali-pro-_TBSAk0RolsLR7gyY_U
-A cali-fw-cali5abca9a20b8 -m comment --comment "cali:c_YvIW5YTpdzsjYn" -m comment --comment "Return if profile accepted" -j RETURN
-A cali-fw-cali5abca9a20b8 -m comment --comment "cali:4Q5u9eQg8gYyiNFp" -m comment --comment "Drop if no profiles matched" -j DROP
-A cali-fw-cali6ff50206ec9 -m comment --comment "cali:TX_eGLELM4Odt83D" -m conntrack --ctstate RELATED,ESTABLISHED -j ACCEPT
-A cali-fw-cali6ff50206ec9 -m comment --comment "cali:h0YA034oWfLeGtFI" -m conntrack --ctstate INVALID -j DROP
-A cali-fw-cali6ff50206ec9 -m comment --comment "cali:pvFyqNfshFFn2-al" -j MARK --set-xmark 0x0/0x30000
-A cali-fw-cali6ff50206ec9 -p udp -m comment --comment "cali:JHiw6zRm-KAPkzT2" -m comment --comment "Drop VXLAN encapped packets originating in workloads" -m multiport --dports 4789 -j DROP
-A cali-fw-cali6ff50206ec9 -p ipencap -m comment --comment "cali:zryi0bw_a6BNwko6" -m comment --comment "Drop IPinIP encapped packets originating in workloads" -j DROP
-A cali-fw-cali6ff50206ec9 -m comment --comment "cali:RFKtxBnJ5JFEX6im" -j cali-pro-_7sLR5_U6vUQFfeZ_3J
-A cali-fw-cali6ff50206ec9 -m comment --comment "cali:1zXuEJWmsg8strwt" -m comment --comment "Return if profile accepted" -j RETURN
-A cali-fw-cali6ff50206ec9 -m comment --comment "cali:poMzlG3TwSj8P3-P" -j cali-pro-_Ccq2yHWYaPdurqTYKX
-A cali-fw-cali6ff50206ec9 -m comment --comment "cali:QeL7Vxx5TyndZm3V" -m comment --comment "Return if profile accepted" -j RETURN
-A cali-fw-cali6ff50206ec9 -m comment --comment "cali:R0NCfrnfs9ysfHNE" -m comment --comment "Drop if no profiles matched" -j DROP
-A cali-fw-cali72199f7015c -m comment --comment "cali:SIqulWUh7JTd2TBE" -m conntrack --ctstate RELATED,ESTABLISHED -j ACCEPT
-A cali-fw-cali72199f7015c -m comment --comment "cali:gg1SvbV06KhVD6-l" -m conntrack --ctstate INVALID -j DROP
-A cali-fw-cali72199f7015c -m comment --comment "cali:A0O4XLBVd0wRc1np" -j MARK --set-xmark 0x0/0x30000
-A cali-fw-cali72199f7015c -p udp -m comment --comment "cali:ZB4WA5-MixfeNzky" -m comment --comment "Drop VXLAN encapped packets originating in workloads" -m multiport --dports 4789 -j DROP
-A cali-fw-cali72199f7015c -p ipencap -m comment --comment "cali:Ys2B3-QWf6HNPC4Y" -m comment --comment "Drop IPinIP encapped packets originating in workloads" -j DROP
-A cali-fw-cali72199f7015c -m comment --comment "cali:juym-4LrMgoIiEgq" -j cali-pro-_7sLR5_U6vUQFfeZ_3J
-A cali-fw-cali72199f7015c -m comment --comment "cali:1G43tLpz_qCdQmmu" -m comment --comment "Return if profile accepted" -j RETURN
-A cali-fw-cali72199f7015c -m comment --comment "cali:XziHhS6ZMOgfyIDc" -j cali-pro-_9wXc41akjYX6CbTda_
-A cali-fw-cali72199f7015c -m comment --comment "cali:8A5tYJ9zUXnk2-5B" -m comment --comment "Return if profile accepted" -j RETURN
-A cali-fw-cali72199f7015c -m comment --comment "cali:NqxDAWoNKoulhbA-" -m comment --comment "Drop if no profiles matched" -j DROP
-A cali-fw-cali97f907a8190 -m comment --comment "cali:ySzkd1VAHUDerKcY" -m conntrack --ctstate RELATED,ESTABLISHED -j ACCEPT
-A cali-fw-cali97f907a8190 -m comment --comment "cali:aMiWovnar4-W2K98" -m conntrack --ctstate INVALID -j DROP
-A cali-fw-cali97f907a8190 -m comment --comment "cali:C3WzUi97pbkkT5Ea" -j MARK --set-xmark 0x0/0x30000
-A cali-fw-cali97f907a8190 -p udp -m comment --comment "cali:YB5E-WSYMmL3TtQl" -m comment --comment "Drop VXLAN encapped packets originating in workloads" -m multiport --dports 4789 -j DROP
-A cali-fw-cali97f907a8190 -p ipencap -m comment --comment "cali:qJKkTWFLSv8g7EBD" -m comment --comment "Drop IPinIP encapped packets originating in workloads" -j DROP
-A cali-fw-cali97f907a8190 -m comment --comment "cali:9X0aFX7mmfq8XnRR" -j cali-pro-kns.kube-system
-A cali-fw-cali97f907a8190 -m comment --comment "cali:sUZOlOXbn2mCFZwM" -m comment --comment "Return if profile accepted" -j RETURN
-A cali-fw-cali97f907a8190 -m comment --comment "cali:CJGSolnMCLZiwgxe" -j cali-pro-_GyLFhtf5u9n-v9Ckd7
-A cali-fw-cali97f907a8190 -m comment --comment "cali:4Up-mK5VmG6Nd8D3" -m comment --comment "Return if profile accepted" -j RETURN
-A cali-fw-cali97f907a8190 -m comment --comment "cali:16WCJOamRtLR1rtA" -m comment --comment "Drop if no profiles matched" -j DROP
-A cali-fw-caliadcbc557ae8 -m comment --comment "cali:tYNonNTsKkHUlMOb" -m conntrack --ctstate RELATED,ESTABLISHED -j ACCEPT
-A cali-fw-caliadcbc557ae8 -m comment --comment "cali:d5erx2cRV5HtlzSd" -m conntrack --ctstate INVALID -j DROP
-A cali-fw-caliadcbc557ae8 -m comment --comment "cali:dPga7sDmbJBrbYmq" -j MARK --set-xmark 0x0/0x30000
-A cali-fw-caliadcbc557ae8 -p udp -m comment --comment "cali:zq07cDWOZon0qXK5" -m comment --comment "Drop VXLAN encapped packets originating in workloads" -m multiport --dports 4789 -j DROP
-A cali-fw-caliadcbc557ae8 -p ipencap -m comment --comment "cali:LcWmhzjOW-4diywS" -m comment --comment "Drop IPinIP encapped packets originating in workloads" -j DROP
-A cali-fw-caliadcbc557ae8 -m comment --comment "cali:A7eNvCg99eK0PNXe" -j cali-pro-_7sLR5_U6vUQFfeZ_3J
-A cali-fw-caliadcbc557ae8 -m comment --comment "cali:-L3mUMyaFld7-1dM" -m comment --comment "Return if profile accepted" -j RETURN
-A cali-fw-caliadcbc557ae8 -m comment --comment "cali:E2OIZdGLIxxmhT5h" -j cali-pro-_7PAcU-eJyOsb9Xu8NB
-A cali-fw-caliadcbc557ae8 -m comment --comment "cali:tn9EdkPl8B2si3NT" -m comment --comment "Return if profile accepted" -j RETURN
-A cali-fw-caliadcbc557ae8 -m comment --comment "cali:AzhZCORezxAPuMQF" -m comment --comment "Drop if no profiles matched" -j DROP
-A cali-fw-calic79234d36a5 -m comment --comment "cali:DLov1nE1ndO3vm8L" -m conntrack --ctstate RELATED,ESTABLISHED -j ACCEPT
-A cali-fw-calic79234d36a5 -m comment --comment "cali:G6M_55AcWMYCJeRK" -m conntrack --ctstate INVALID -j DROP
-A cali-fw-calic79234d36a5 -m comment --comment "cali:xMmHIWEQG-djU2-H" -j MARK --set-xmark 0x0/0x30000
-A cali-fw-calic79234d36a5 -p udp -m comment --comment "cali:nVu5QFih3pRg7wFA" -m comment --comment "Drop VXLAN encapped packets originating in workloads" -m multiport --dports 4789 -j DROP
-A cali-fw-calic79234d36a5 -p ipencap -m comment --comment "cali:aJncGrIsYe7SfAsd" -m comment --comment "Drop IPinIP encapped packets originating in workloads" -j DROP
-A cali-fw-calic79234d36a5 -m comment --comment "cali:YELddTm36KwYlHIS" -j cali-pro-kns.egress
-A cali-fw-calic79234d36a5 -m comment --comment "cali:AwKjsL7yIFyf-tY_" -m comment --comment "Return if profile accepted" -j RETURN
-A cali-fw-calic79234d36a5 -m comment --comment "cali:usUF1S1eaCGSpehi" -j cali-pro-_lBs4svX6CHFDB_yqJt
-A cali-fw-calic79234d36a5 -m comment --comment "cali:E29BfVq3vNLNXcCE" -m comment --comment "Return if profile accepted" -j RETURN
-A cali-fw-calic79234d36a5 -m comment --comment "cali:_v5A_dXDm5BpPZPa" -m comment --comment "Drop if no profiles matched" -j DROP
-A cali-fw-calid2faaa3a8df -m comment --comment "cali:7MC8dOhWpz3iQAk-" -m conntrack --ctstate RELATED,ESTABLISHED -j ACCEPT
-A cali-fw-calid2faaa3a8df -m comment --comment "cali:g5QNCGIt6ynwSefs" -m conntrack --ctstate INVALID -j DROP
-A cali-fw-calid2faaa3a8df -m comment --comment "cali:v2NvJa_FfiEhfKjN" -j MARK --set-xmark 0x0/0x30000
-A cali-fw-calid2faaa3a8df -p udp -m comment --comment "cali:j-x2KDMRRZvlVckD" -m comment --comment "Drop VXLAN encapped packets originating in workloads" -m multiport --dports 4789 -j DROP
-A cali-fw-calid2faaa3a8df -p ipencap -m comment --comment "cali:VGCux0pupDW37ZJH" -m comment --comment "Drop IPinIP encapped packets originating in workloads" -j DROP
-A cali-fw-calid2faaa3a8df -m comment --comment "cali:EYnS7JeJWym9jyS5" -j cali-pro-_7sLR5_U6vUQFfeZ_3J
-A cali-fw-calid2faaa3a8df -m comment --comment "cali:47LmfB6yONMY-fIu" -m comment --comment "Return if profile accepted" -j RETURN
-A cali-fw-calid2faaa3a8df -m comment --comment "cali:rAZ9dcFLBLiw440Y" -j cali-pro-_jfwf7TL6GWNgbdQkTH
-A cali-fw-calid2faaa3a8df -m comment --comment "cali:StO0-IcvvPYNSSjK" -m comment --comment "Return if profile accepted" -j RETURN
-A cali-fw-calid2faaa3a8df -m comment --comment "cali:gM9N8qPrv7qd-A8V" -m comment --comment "Drop if no profiles matched" -j DROP
-A cali-fw-califef0bc22feb -m comment --comment "cali:3uo0lW7movQRakz_" -m conntrack --ctstate RELATED,ESTABLISHED -j ACCEPT
-A cali-fw-califef0bc22feb -m comment --comment "cali:_1PlqySzLlrZlVcI" -m conntrack --ctstate INVALID -j DROP
-A cali-fw-califef0bc22feb -m comment --comment "cali:chjBDc196N78ADHc" -j MARK --set-xmark 0x0/0x30000
-A cali-fw-califef0bc22feb -p udp -m comment --comment "cali:f92nYO_QAe4NFqNv" -m comment --comment "Drop VXLAN encapped packets originating in workloads" -m multiport --dports 4789 -j DROP
-A cali-fw-califef0bc22feb -p ipencap -m comment --comment "cali:bM5sAV7VNiJgykR3" -m comment --comment "Drop IPinIP encapped packets originating in workloads" -j DROP
-A cali-fw-califef0bc22feb -m comment --comment "cali:X_xOR_yyH1Yl_y9f" -j cali-pro-_7sLR5_U6vUQFfeZ_3J
-A cali-fw-califef0bc22feb -m comment --comment "cali:fy56FsNLaMIHBYTs" -m comment --comment "Return if profile accepted" -j RETURN
-A cali-fw-califef0bc22feb -m comment --comment "cali:JQGE9CnWwZKV5e-t" -j cali-pro-_2Qe4kInhqKlw-GMehI
-A cali-fw-califef0bc22feb -m comment --comment "cali:KRlLMeUZK35Mm2M5" -m comment --comment "Return if profile accepted" -j RETURN
-A cali-fw-califef0bc22feb -m comment --comment "cali:exK-RQzpWeACZ7p6" -m comment --comment "Drop if no profiles matched" -j DROP
-A cali-pri-_2Qe4kInhqKlw-GMehI -m comment --comment "cali:VELIc-x6Wf5CUvja" -m comment --comment "Profile ksa.nvidia-gpu-operator.nvidia-gpu-feature-discovery ingress"
-A cali-pri-_7PAcU-eJyOsb9Xu8NB -m comment --comment "cali:6Rhhne1DaeMjjkZM" -m comment --comment "Profile ksa.nvidia-gpu-operator.nvidia-dcgm-exporter ingress"
-A cali-pri-_7sLR5_U6vUQFfeZ_3J -m comment --comment "cali:12-IT9RIU-jUAPr2" -m comment --comment "Profile kns.nvidia-gpu-operator ingress" -j MARK --set-xmark 0x10000/0x10000
-A cali-pri-_9wXc41akjYX6CbTda_ -m comment --comment "cali:-HuC6UGMTT9nHELW" -m comment --comment "Profile ksa.nvidia-gpu-operator.node-feature-discovery ingress"
-A cali-pri-_Ccq2yHWYaPdurqTYKX -m comment --comment "cali:xXtwXZPMBZHnxpZ6" -m comment --comment "Profile ksa.nvidia-gpu-operator.nvidia-mig-manager ingress"
-A cali-pri-_GyLFhtf5u9n-v9Ckd7 -m comment --comment "cali:Z9reHIOsxthYGfQR" -m comment --comment "Profile ksa.kube-system.rke2-ingress-nginx ingress"
-A cali-pri-_TBSAk0RolsLR7gyY_U -m comment --comment "cali:Gf7rnQ1Ze3aLWPjw" -m comment --comment "Profile ksa.nvidia-gpu-operator.nvidia-device-plugin ingress"
-A cali-pri-_YhxsgXk11JV_YlfoPn -m comment --comment "cali:iJl1H5PmB7ET1cd7" -m comment --comment "Profile ksa.nvidia-gpu-operator.nvidia-container-toolkit ingress"
-A cali-pri-_jfwf7TL6GWNgbdQkTH -m comment --comment "cali:i8XSnqq7MfNRFoQO" -m comment --comment "Profile ksa.nvidia-gpu-operator.nvidia-operator-validator ingress"
-A cali-pri-_lBs4svX6CHFDB_yqJt -m comment --comment "cali:d6ADqB1j_heeGP2S" -m comment --comment "Profile ksa.egress.egressgateway-controller ingress"
-A cali-pri-kns.default -m comment --comment "cali:WMSw8BmYOknRHfsz" -m comment --comment "Profile kns.default ingress" -j MARK --set-xmark 0x10000/0x10000
-A cali-pri-kns.egress -m comment --comment "cali:PjaZh8i-ZeKOwYwD" -m comment --comment "Profile kns.egress ingress" -j MARK --set-xmark 0x10000/0x10000
-A cali-pri-kns.kube-system -m comment --comment "cali:J1TyxtHWd0qaBGK-" -m comment --comment "Profile kns.kube-system ingress" -j MARK --set-xmark 0x10000/0x10000
-A cali-pri-ksa.default.default -m comment --comment "cali:PrckJA84jX_kGp99" -m comment --comment "Profile ksa.default.default ingress"
-A cali-pro-_2Qe4kInhqKlw-GMehI -m comment --comment "cali:gOgCCx3P13a8MedX" -m comment --comment "Profile ksa.nvidia-gpu-operator.nvidia-gpu-feature-discovery egress"
-A cali-pro-_7PAcU-eJyOsb9Xu8NB -m comment --comment "cali:jsnNUTIMD-GTp4hq" -m comment --comment "Profile ksa.nvidia-gpu-operator.nvidia-dcgm-exporter egress"
-A cali-pro-_7sLR5_U6vUQFfeZ_3J -m comment --comment "cali:QTxr0KRG-HF3oQaP" -m comment --comment "Profile kns.nvidia-gpu-operator egress" -j MARK --set-xmark 0x10000/0x10000
-A cali-pro-_9wXc41akjYX6CbTda_ -m comment --comment "cali:jSaID_1tY6k_HHI0" -m comment --comment "Profile ksa.nvidia-gpu-operator.node-feature-discovery egress"
-A cali-pro-_Ccq2yHWYaPdurqTYKX -m comment --comment "cali:poXtccRGk2Wu39Pe" -m comment --comment "Profile ksa.nvidia-gpu-operator.nvidia-mig-manager egress"
-A cali-pro-_GyLFhtf5u9n-v9Ckd7 -m comment --comment "cali:H-PEsWIdyoAji9Ks" -m comment --comment "Profile ksa.kube-system.rke2-ingress-nginx egress"
-A cali-pro-_TBSAk0RolsLR7gyY_U -m comment --comment "cali:8mQE0kFmenrsoRoG" -m comment --comment "Profile ksa.nvidia-gpu-operator.nvidia-device-plugin egress"
-A cali-pro-_YhxsgXk11JV_YlfoPn -m comment --comment "cali:EdB2GRloKtJtD_eQ" -m comment --comment "Profile ksa.nvidia-gpu-operator.nvidia-container-toolkit egress"
-A cali-pro-_jfwf7TL6GWNgbdQkTH -m comment --comment "cali:0UthHBishx_Jfs_P" -m comment --comment "Profile ksa.nvidia-gpu-operator.nvidia-operator-validator egress"
-A cali-pro-_lBs4svX6CHFDB_yqJt -m comment --comment "cali:o-djSItBckcwu5ha" -m comment --comment "Profile ksa.egress.egressgateway-controller egress"
-A cali-pro-kns.default -m comment --comment "cali:Vr81boRqq4V77Sg8" -m comment --comment "Profile kns.default egress" -j MARK --set-xmark 0x10000/0x10000
-A cali-pro-kns.egress -m comment --comment "cali:8uUXUW6XfZGwPU_P" -m comment --comment "Profile kns.egress egress" -j MARK --set-xmark 0x10000/0x10000
-A cali-pro-kns.kube-system -m comment --comment "cali:tgOR2S8DVHZW3F1M" -m comment --comment "Profile kns.kube-system egress" -j MARK --set-xmark 0x10000/0x10000
-A cali-pro-ksa.default.default -m comment --comment "cali:bUZzZcietq9v5Ybq" -m comment --comment "Profile ksa.default.default egress"
-A cali-set-endpoint-mark -i cali01a377c2e85 -m comment --comment "cali:p4QwOnvsonzhbxpk" -g cali-sm-cali01a377c2e85
-A cali-set-endpoint-mark -i cali4ab24bb9148 -m comment --comment "cali:YEtBY8NqtnIVZhGb" -g cali-sm-cali4ab24bb9148
-A cali-set-endpoint-mark -i cali5abca9a20b8 -m comment --comment "cali:-z3SDmSViuBiTz9t" -g cali-sm-cali5abca9a20b8
-A cali-set-endpoint-mark -i cali6ff50206ec9 -m comment --comment "cali:erHNGCK2GVmr-yU3" -g cali-sm-cali6ff50206ec9
-A cali-set-endpoint-mark -i cali72199f7015c -m comment --comment "cali:wdVKrbUl4JPn8xDh" -g cali-sm-cali72199f7015c
-A cali-set-endpoint-mark -i cali97f907a8190 -m comment --comment "cali:yt7dXBfwqN2d67DZ" -g cali-sm-cali97f907a8190
-A cali-set-endpoint-mark -i caliadcbc557ae8 -m comment --comment "cali:uubsLQnkkYxKXKIM" -g cali-sm-caliadcbc557ae8
-A cali-set-endpoint-mark -i calic79234d36a5 -m comment --comment "cali:GFpxrUQxkAk0VEHQ" -g cali-sm-calic79234d36a5
-A cali-set-endpoint-mark -i calid2faaa3a8df -m comment --comment "cali:74ax3uiMjDyM-3iV" -g cali-sm-calid2faaa3a8df
-A cali-set-endpoint-mark -i califef0bc22feb -m comment --comment "cali:XqyBim5B_P5g6YgA" -g cali-sm-califef0bc22feb
-A cali-set-endpoint-mark -i cali+ -m comment --comment "cali:kNPPXivmDAnUt2NM" -m comment --comment "Unknown endpoint" -j DROP
-A cali-set-endpoint-mark -m comment --comment "cali:M62qPF6tJt3ns1Uy" -m comment --comment "Non-Cali endpoint mark" -j MARK --set-xmark 0x100000/0xfff00000
-A cali-sm-cali01a377c2e85 -m comment --comment "cali:2Yf8TrfkHR1EQojv" -j MARK --set-xmark 0x66800000/0xfff00000
-A cali-sm-cali4ab24bb9148 -m comment --comment "cali:mbd8C3qJV6AXr9wD" -j MARK --set-xmark 0x5d00000/0xfff00000
-A cali-sm-cali5abca9a20b8 -m comment --comment "cali:oFAmIwCDKSaDMEvZ" -j MARK --set-xmark 0x30200000/0xfff00000
-A cali-sm-cali6ff50206ec9 -m comment --comment "cali:ryILD4tJnCw4JQyZ" -j MARK --set-xmark 0x47800000/0xfff00000
-A cali-sm-cali72199f7015c -m comment --comment "cali:oAKVH-qMVPRvGA8M" -j MARK --set-xmark 0xc5a00000/0xfff00000
-A cali-sm-cali97f907a8190 -m comment --comment "cali:5EjOxT0Q3EbDeOvB" -j MARK --set-xmark 0xeb00000/0xfff00000
-A cali-sm-caliadcbc557ae8 -m comment --comment "cali:n9S2XezsKCQrGXUD" -j MARK --set-xmark 0x16e00000/0xfff00000
-A cali-sm-calic79234d36a5 -m comment --comment "cali:nOmaoSu1f2vJqFYs" -j MARK --set-xmark 0x66b00000/0xfff00000
-A cali-sm-calid2faaa3a8df -m comment --comment "cali:m6xeg8LwYl4zSlCq" -j MARK --set-xmark 0x96f00000/0xfff00000
-A cali-sm-califef0bc22feb -m comment --comment "cali:d4ctpeSBIlDrBelG" -j MARK --set-xmark 0xcfb00000/0xfff00000
-A cali-to-wl-dispatch -o cali01a377c2e85 -m comment --comment "cali:BgvYC3BTqb3IC3VV" -g cali-tw-cali01a377c2e85
-A cali-to-wl-dispatch -o cali4ab24bb9148 -m comment --comment "cali:HaxHM4767oW1FHD2" -g cali-tw-cali4ab24bb9148
-A cali-to-wl-dispatch -o cali5abca9a20b8 -m comment --comment "cali:GyzLlflqWWhSB07V" -g cali-tw-cali5abca9a20b8
-A cali-to-wl-dispatch -o cali6ff50206ec9 -m comment --comment "cali:Py_g7J1duiNV7VY-" -g cali-tw-cali6ff50206ec9
-A cali-to-wl-dispatch -o cali72199f7015c -m comment --comment "cali:7N3K58PR6VibLb9h" -g cali-tw-cali72199f7015c
-A cali-to-wl-dispatch -o cali97f907a8190 -m comment --comment "cali:LeqLHFKm3rxxkaaj" -g cali-tw-cali97f907a8190
-A cali-to-wl-dispatch -o caliadcbc557ae8 -m comment --comment "cali:srj8WndVMLsfHKc-" -g cali-tw-caliadcbc557ae8
-A cali-to-wl-dispatch -o calic79234d36a5 -m comment --comment "cali:vjSIJal_gQM8X-yp" -g cali-tw-calic79234d36a5
-A cali-to-wl-dispatch -o calid2faaa3a8df -m comment --comment "cali:BUTiIYOlShFIhw5N" -g cali-tw-calid2faaa3a8df
-A cali-to-wl-dispatch -o califef0bc22feb -m comment --comment "cali:VTQxj0VfdHONCMNj" -g cali-tw-califef0bc22feb
-A cali-to-wl-dispatch -m comment --comment "cali:Vm6rKg3D_XR5Awaq" -m comment --comment "Unknown interface" -j DROP
-A cali-tw-cali01a377c2e85 -m comment --comment "cali:udnD_gYsBhGH2AFN" -m conntrack --ctstate RELATED,ESTABLISHED -j ACCEPT
-A cali-tw-cali01a377c2e85 -m comment --comment "cali:6zD3e-4HJ0dsqJmp" -m conntrack --ctstate INVALID -j DROP
-A cali-tw-cali01a377c2e85 -m comment --comment "cali:MSD1DHBU-5xWCAEc" -j MARK --set-xmark 0x0/0x30000
-A cali-tw-cali01a377c2e85 -m comment --comment "cali:Z8PIQBawbh9sKoSY" -j cali-pri-_7sLR5_U6vUQFfeZ_3J
-A cali-tw-cali01a377c2e85 -m comment --comment "cali:YJPqURMDN7Zx8EjQ" -m comment --comment "Return if profile accepted" -j RETURN
-A cali-tw-cali01a377c2e85 -m comment --comment "cali:hWtHFVS8e3floisE" -j cali-pri-_YhxsgXk11JV_YlfoPn
-A cali-tw-cali01a377c2e85 -m comment --comment "cali:VmDand11y_nCf9y6" -m comment --comment "Return if profile accepted" -j RETURN
-A cali-tw-cali01a377c2e85 -m comment --comment "cali:oZiF31Pe6wxoG89d" -m comment --comment "Drop if no profiles matched" -j DROP
-A cali-tw-cali4ab24bb9148 -m comment --comment "cali:zxTAV6rB9w-s-uq0" -m conntrack --ctstate RELATED,ESTABLISHED -j ACCEPT
-A cali-tw-cali4ab24bb9148 -m comment --comment "cali:cQq9Hl21ZRbExcvG" -m conntrack --ctstate INVALID -j DROP
-A cali-tw-cali4ab24bb9148 -m comment --comment "cali:N4ZzPMTl-TO0cN1I" -j MARK --set-xmark 0x0/0x30000
-A cali-tw-cali4ab24bb9148 -m comment --comment "cali:vM_Cw8gBm2v-mttT" -j cali-pri-kns.default
-A cali-tw-cali4ab24bb9148 -m comment --comment "cali:M_0uTrdohEHrMb2n" -m comment --comment "Return if profile accepted" -j RETURN
-A cali-tw-cali4ab24bb9148 -m comment --comment "cali:nA-3n1LtfkoPVucE" -j cali-pri-ksa.default.default
-A cali-tw-cali4ab24bb9148 -m comment --comment "cali:6AhMqNN5obDhy-zH" -m comment --comment "Return if profile accepted" -j RETURN
-A cali-tw-cali4ab24bb9148 -m comment --comment "cali:mkNfjfgoF5_DQWii" -m comment --comment "Drop if no profiles matched" -j DROP
-A cali-tw-cali5abca9a20b8 -m comment --comment "cali:fVKgiTxf2H5qJ8gL" -m conntrack --ctstate RELATED,ESTABLISHED -j ACCEPT
-A cali-tw-cali5abca9a20b8 -m comment --comment "cali:L2lT9JkSqpriQNSj" -m conntrack --ctstate INVALID -j DROP
-A cali-tw-cali5abca9a20b8 -m comment --comment "cali:qSo39U93Ydy38-7k" -j MARK --set-xmark 0x0/0x30000
-A cali-tw-cali5abca9a20b8 -m comment --comment "cali:m0SKHoogi0I7vtIQ" -j cali-pri-_7sLR5_U6vUQFfeZ_3J
-A cali-tw-cali5abca9a20b8 -m comment --comment "cali:CCN-IdpuEfM_lKa-" -m comment --comment "Return if profile accepted" -j RETURN
-A cali-tw-cali5abca9a20b8 -m comment --comment "cali:dvPTd8kq2kjFVP0W" -j cali-pri-_TBSAk0RolsLR7gyY_U
-A cali-tw-cali5abca9a20b8 -m comment --comment "cali:W_GKqlsKm3aMudxj" -m comment --comment "Return if profile accepted" -j RETURN
-A cali-tw-cali5abca9a20b8 -m comment --comment "cali:_hOpX87j7ReT9h3c" -m comment --comment "Drop if no profiles matched" -j DROP
-A cali-tw-cali6ff50206ec9 -m comment --comment "cali:Qfr95AcnBim9wPLm" -m conntrack --ctstate RELATED,ESTABLISHED -j ACCEPT
-A cali-tw-cali6ff50206ec9 -m comment --comment "cali:-YgIJzL7D483l1cT" -m conntrack --ctstate INVALID -j DROP
-A cali-tw-cali6ff50206ec9 -m comment --comment "cali:nqc18uCLNFOtCt0u" -j MARK --set-xmark 0x0/0x30000
-A cali-tw-cali6ff50206ec9 -m comment --comment "cali:Qbf9XFMfyTZIcjKa" -j cali-pri-_7sLR5_U6vUQFfeZ_3J
-A cali-tw-cali6ff50206ec9 -m comment --comment "cali:BrAIzCZfyTkxy_8u" -m comment --comment "Return if profile accepted" -j RETURN
-A cali-tw-cali6ff50206ec9 -m comment --comment "cali:KouStttnDpB0A2by" -j cali-pri-_Ccq2yHWYaPdurqTYKX
-A cali-tw-cali6ff50206ec9 -m comment --comment "cali:9QIiOU_04cgnpDfv" -m comment --comment "Return if profile accepted" -j RETURN
-A cali-tw-cali6ff50206ec9 -m comment --comment "cali:8ZF1ifgIFsM5iiPK" -m comment --comment "Drop if no profiles matched" -j DROP
-A cali-tw-cali72199f7015c -m comment --comment "cali:CEvJUoYsUaxbVbIC" -m conntrack --ctstate RELATED,ESTABLISHED -j ACCEPT
-A cali-tw-cali72199f7015c -m comment --comment "cali:ujAv_8USSl9Cua5Z" -m conntrack --ctstate INVALID -j DROP
-A cali-tw-cali72199f7015c -m comment --comment "cali:eWbf4GoDiqr55VLJ" -j MARK --set-xmark 0x0/0x30000
-A cali-tw-cali72199f7015c -m comment --comment "cali:1A0FWEjmRp0MIECN" -j cali-pri-_7sLR5_U6vUQFfeZ_3J
-A cali-tw-cali72199f7015c -m comment --comment "cali:IvXXRvUeBJpDXmpA" -m comment --comment "Return if profile accepted" -j RETURN
-A cali-tw-cali72199f7015c -m comment --comment "cali:Ec0Bm5CT_cY0RjgV" -j cali-pri-_9wXc41akjYX6CbTda_
-A cali-tw-cali72199f7015c -m comment --comment "cali:sYNAon6lMAAPEwH6" -m comment --comment "Return if profile accepted" -j RETURN
-A cali-tw-cali72199f7015c -m comment --comment "cali:5eevMQfPiBYkBjvf" -m comment --comment "Drop if no profiles matched" -j DROP
-A cali-tw-cali97f907a8190 -m comment --comment "cali:Xf-M84NDlXyD4hLy" -m conntrack --ctstate RELATED,ESTABLISHED -j ACCEPT
-A cali-tw-cali97f907a8190 -m comment --comment "cali:eZfUsl9PiRzuhn9z" -m conntrack --ctstate INVALID -j DROP
-A cali-tw-cali97f907a8190 -m comment --comment "cali:S3c5SExkKDyIahBK" -j MARK --set-xmark 0x0/0x30000
-A cali-tw-cali97f907a8190 -m comment --comment "cali:k7QuLLQdRjT3w-aO" -j cali-pri-kns.kube-system
-A cali-tw-cali97f907a8190 -m comment --comment "cali:JMGRgbIVSBEdnuCY" -m comment --comment "Return if profile accepted" -j RETURN
-A cali-tw-cali97f907a8190 -m comment --comment "cali:KDE0UtqBWRXnatWt" -j cali-pri-_GyLFhtf5u9n-v9Ckd7
-A cali-tw-cali97f907a8190 -m comment --comment "cali:90AZHcqRcC5yDrzE" -m comment --comment "Return if profile accepted" -j RETURN
-A cali-tw-cali97f907a8190 -m comment --comment "cali:-6MYOteRyc6q_UR4" -m comment --comment "Drop if no profiles matched" -j DROP
-A cali-tw-caliadcbc557ae8 -m comment --comment "cali:X1jKyqgZHTHTG7iC" -m conntrack --ctstate RELATED,ESTABLISHED -j ACCEPT
-A cali-tw-caliadcbc557ae8 -m comment --comment "cali:OYFV8gHC3vyKE3QG" -m conntrack --ctstate INVALID -j DROP
-A cali-tw-caliadcbc557ae8 -m comment --comment "cali:hc9uqYjmPHO-t88H" -j MARK --set-xmark 0x0/0x30000
-A cali-tw-caliadcbc557ae8 -m comment --comment "cali:vJWs9SBRPOdq14Ft" -j cali-pri-_7sLR5_U6vUQFfeZ_3J
-A cali-tw-caliadcbc557ae8 -m comment --comment "cali:mTkI_BUKSuoCFBvq" -m comment --comment "Return if profile accepted" -j RETURN
-A cali-tw-caliadcbc557ae8 -m comment --comment "cali:qdsuJzHVnnbWxHr3" -j cali-pri-_7PAcU-eJyOsb9Xu8NB
-A cali-tw-caliadcbc557ae8 -m comment --comment "cali:gC1nDLB-r3ZTnLVe" -m comment --comment "Return if profile accepted" -j RETURN
-A cali-tw-caliadcbc557ae8 -m comment --comment "cali:Nk-rUZ_cWmJh9_Z5" -m comment --comment "Drop if no profiles matched" -j DROP
-A cali-tw-calic79234d36a5 -m comment --comment "cali:2yNjJ1O7ESx4zEHx" -m conntrack --ctstate RELATED,ESTABLISHED -j ACCEPT
-A cali-tw-calic79234d36a5 -m comment --comment "cali:b8gSKVLCELPHqON0" -m conntrack --ctstate INVALID -j DROP
-A cali-tw-calic79234d36a5 -m comment --comment "cali:KYBjGzjJVUPm6Ddk" -j MARK --set-xmark 0x0/0x30000
-A cali-tw-calic79234d36a5 -m comment --comment "cali:Qe_bOJSZJ8UNrFfq" -j cali-pri-kns.egress
-A cali-tw-calic79234d36a5 -m comment --comment "cali:bo_rjubPFEvif8Lg" -m comment --comment "Return if profile accepted" -j RETURN
-A cali-tw-calic79234d36a5 -m comment --comment "cali:loKz0rM-wIm56pFB" -j cali-pri-_lBs4svX6CHFDB_yqJt
-A cali-tw-calic79234d36a5 -m comment --comment "cali:W1DjW2xOCYoK82vI" -m comment --comment "Return if profile accepted" -j RETURN
-A cali-tw-calic79234d36a5 -m comment --comment "cali:cYqcra51-5sJyT-C" -m comment --comment "Drop if no profiles matched" -j DROP
-A cali-tw-calid2faaa3a8df -m comment --comment "cali:k7PE7L_HYDqrfskP" -m conntrack --ctstate RELATED,ESTABLISHED -j ACCEPT
-A cali-tw-calid2faaa3a8df -m comment --comment "cali:H9vYOq7s60lcqctp" -m conntrack --ctstate INVALID -j DROP
-A cali-tw-calid2faaa3a8df -m comment --comment "cali:gxlGF6QrMKYv3pre" -j MARK --set-xmark 0x0/0x30000
-A cali-tw-calid2faaa3a8df -m comment --comment "cali:AnNZJCoAm55FaPhG" -j cali-pri-_7sLR5_U6vUQFfeZ_3J
-A cali-tw-calid2faaa3a8df -m comment --comment "cali:QOVRSGjT-uFR03KA" -m comment --comment "Return if profile accepted" -j RETURN
-A cali-tw-calid2faaa3a8df -m comment --comment "cali:_0RV4RihxukK0RxR" -j cali-pri-_jfwf7TL6GWNgbdQkTH
-A cali-tw-calid2faaa3a8df -m comment --comment "cali:Mv0G7JK4q2Y9I5to" -m comment --comment "Return if profile accepted" -j RETURN
-A cali-tw-calid2faaa3a8df -m comment --comment "cali:PSXamI6wZ2HQMEmn" -m comment --comment "Drop if no profiles matched" -j DROP
-A cali-tw-califef0bc22feb -m comment --comment "cali:9QJPEIYWEf8qao8E" -m conntrack --ctstate RELATED,ESTABLISHED -j ACCEPT
-A cali-tw-califef0bc22feb -m comment --comment "cali:0UDddD-fwUjCMSDg" -m conntrack --ctstate INVALID -j DROP
-A cali-tw-califef0bc22feb -m comment --comment "cali:qlxboJ7UUzPcia1H" -j MARK --set-xmark 0x0/0x30000
-A cali-tw-califef0bc22feb -m comment --comment "cali:npPVDQurAbwUkPD4" -j cali-pri-_7sLR5_U6vUQFfeZ_3J
-A cali-tw-califef0bc22feb -m comment --comment "cali:oDUMVHFqs3TExixN" -m comment --comment "Return if profile accepted" -j RETURN
-A cali-tw-califef0bc22feb -m comment --comment "cali:4aX4p6lxjnQe8VHs" -j cali-pri-_2Qe4kInhqKlw-GMehI
-A cali-tw-califef0bc22feb -m comment --comment "cali:lNABupBHJxCSt370" -m comment --comment "Return if profile accepted" -j RETURN
-A cali-tw-califef0bc22feb -m comment --comment "cali:xtsZXW67CqEohu2w" -m comment --comment "Drop if no profiles matched" -j DROP
-A cali-wl-to-host -m comment --comment "cali:Ee9Sbo10IpVujdIY" -j cali-from-wl-dispatch
-A cali-wl-to-host -m comment --comment "cali:nSZbcOoG1xPONxb8" -m comment --comment "Configured DefaultEndpointToHostAction" -j ACCEPT
COMMIT
# Completed on Wed Nov 12 08:25:12 2025
# Generated by iptables-save v1.8.7 on Wed Nov 12 08:25:12 2025
*nat
:PREROUTING ACCEPT [0:0]
:INPUT ACCEPT [0:0]
:OUTPUT ACCEPT [0:0]
:POSTROUTING ACCEPT [0:0]
:CNI-DN-77751b4ca4b7ed57f4181 - [0:0]
:CNI-HOSTPORT-DNAT - [0:0]
:CNI-HOSTPORT-MASQ - [0:0]
:CNI-HOSTPORT-SETMARK - [0:0]
:EGRESSGATEWAY-SNAT-EIP - [0:0]
:KUBE-KUBELET-CANARY - [0:0]
:KUBE-LOAD-BALANCER - [0:0]
:KUBE-MARK-MASQ - [0:0]
:KUBE-NODE-PORT - [0:0]
:KUBE-POSTROUTING - [0:0]
:KUBE-SERVICES - [0:0]
:cali-OUTPUT - [0:0]
:cali-POSTROUTING - [0:0]
:cali-PREROUTING - [0:0]
:cali-fip-dnat - [0:0]
:cali-fip-snat - [0:0]
:cali-nat-outgoing - [0:0]
-A PREROUTING -m comment --comment "egw:bx14gEwdI2z4JR7V" -m comment --comment "EgressGateway traffic accept datapath rule" -m mark --mark 0x26000000/0xff000000 -j ACCEPT
-A PREROUTING -m comment --comment "kubernetes service portals" -j KUBE-SERVICES
-A PREROUTING -m addrtype --dst-type LOCAL -j CNI-HOSTPORT-DNAT
-A PREROUTING -m comment --comment "cali:6gwbT8clXdHdC1b1" -j cali-PREROUTING
-A OUTPUT -m comment --comment "kubernetes service portals" -j KUBE-SERVICES
-A OUTPUT -m addrtype --dst-type LOCAL -j CNI-HOSTPORT-DNAT
-A OUTPUT -m comment --comment "cali:tVnHkvAo15HuiPy0" -j cali-OUTPUT
-A POSTROUTING -m comment --comment "egw:x1tdBi75jif7GCxh" -m comment --comment "SNAT for egress traffic" -j EGRESSGATEWAY-SNAT-EIP
-A POSTROUTING -m comment --comment "egw:lefvkAAcigCbsdOb" -m comment --comment "Accept for egress traffic from pod going to EgressTunnel" -m mark --mark 0x26000000 -j ACCEPT
-A POSTROUTING -m comment --comment "CNI portfwd requiring masquerade" -j CNI-HOSTPORT-MASQ
-A POSTROUTING -m comment --comment "kubernetes postrouting rules" -j KUBE-POSTROUTING
-A POSTROUTING -m comment --comment "cali:0i8pjzKKPyA34aQD" -j cali-POSTROUTING
-A CNI-DN-77751b4ca4b7ed57f4181 -s 10.100.123.230/32 -p tcp -m tcp --dport 80 -j CNI-HOSTPORT-SETMARK
-A CNI-DN-77751b4ca4b7ed57f4181 -s 127.0.0.1/32 -p tcp -m tcp --dport 80 -j CNI-HOSTPORT-SETMARK
-A CNI-DN-77751b4ca4b7ed57f4181 -p tcp -m tcp --dport 80 -j DNAT --to-destination 10.100.123.230:80
-A CNI-DN-77751b4ca4b7ed57f4181 -s 10.100.123.230/32 -p tcp -m tcp --dport 443 -j CNI-HOSTPORT-SETMARK
-A CNI-DN-77751b4ca4b7ed57f4181 -s 127.0.0.1/32 -p tcp -m tcp --dport 443 -j CNI-HOSTPORT-SETMARK
-A CNI-DN-77751b4ca4b7ed57f4181 -p tcp -m tcp --dport 443 -j DNAT --to-destination 10.100.123.230:443
-A CNI-HOSTPORT-DNAT -p tcp -m comment --comment "dnat name: \"k8s-pod-network\" id: \"6a5a70f297b7f5bc4b065c368000330ed89dac741fd98496d6b085e62d0b9436\"" -m multiport --dports 80,443 -j CNI-DN-77751b4ca4b7ed57f4181
-A CNI-HOSTPORT-MASQ -m mark --mark 0x2000/0x2000 -j MASQUERADE
-A CNI-HOSTPORT-SETMARK -m comment --comment "CNI portfwd masquerade mark" -j MARK --set-xmark 0x2000/0x2000
-A KUBE-LOAD-BALANCER -j KUBE-MARK-MASQ
-A KUBE-MARK-MASQ -j MARK --set-xmark 0x4000/0x4000
-A KUBE-NODE-PORT -p tcp -m comment --comment "Kubernetes nodeport TCP port for masquerade purpose" -m set --match-set KUBE-NODE-PORT-TCP dst -j KUBE-MARK-MASQ
-A KUBE-POSTROUTING -m comment --comment "Kubernetes endpoints dst ip:port, source ip for solving hairpin purpose" -m set --match-set KUBE-LOOP-BACK dst,dst,src -j MASQUERADE
-A KUBE-POSTROUTING -j RETURN
-A KUBE-POSTROUTING -j MARK --set-xmark 0x4000/0x0
-A KUBE-POSTROUTING -m comment --comment "kubernetes service traffic requiring SNAT" -j MASQUERADE --random-fully
-A KUBE-SERVICES -s 127.0.0.0/8 -j RETURN
-A KUBE-SERVICES -m comment --comment "Kubernetes service lb portal" -m set --match-set KUBE-LOAD-BALANCER dst,dst -j KUBE-LOAD-BALANCER
-A KUBE-SERVICES ! -s 10.100.0.0/16 -m comment --comment "Kubernetes service cluster ip + port for masquerade purpose" -m set --match-set KUBE-CLUSTER-IP dst,dst -j KUBE-MARK-MASQ
-A KUBE-SERVICES -m addrtype --dst-type LOCAL -j KUBE-NODE-PORT
-A KUBE-SERVICES -m set --match-set KUBE-CLUSTER-IP dst,dst -j ACCEPT
-A KUBE-SERVICES -m set --match-set KUBE-LOAD-BALANCER dst,dst -j ACCEPT
-A cali-OUTPUT -m comment --comment "cali:GBTAv2p5CwevEyJm" -j cali-fip-dnat
-A cali-POSTROUTING -m comment --comment "cali:Z-c7XtVd2Bq7s_hA" -j cali-fip-snat
-A cali-POSTROUTING -m comment --comment "cali:nYKhEzDlr11Jccal" -j cali-nat-outgoing
-A cali-POSTROUTING -o vxlan.calico -m comment --comment "cali:e9dnSgSVNmIcpVhP" -m addrtype ! --src-type LOCAL --limit-iface-out -m addrtype --src-type LOCAL -j MASQUERADE --random-fully
-A cali-PREROUTING -m comment --comment "cali:r6XmIziWUJsdOK6Z" -j cali-fip-dnat
-A cali-nat-outgoing -m comment --comment "cali:flqWnvo8yq4ULQLa" -m set --match-set cali40masq-ipam-pools src -m set ! --match-set cali40all-ipam-pools dst -j MASQUERADE --random-fully
COMMIT
# Completed on Wed Nov 12 08:25:12 2025
```

**Comment by huizsh** [comment]
```
root@ce-worker02-den1-pro1-gpu-0010:~# ip a
1: lo: <LOOPBACK,UP,LOWER_UP> mtu 65536 qdisc noqueue state UNKNOWN group default qlen 1000
    link/loopback 00:00:00:00:00:00 brd 00:00:00:00:00:00
    inet 127.0.0.1/8 scope host lo
       valid_lft forever preferred_lft forever
    inet6 ::1/128 scope host
       valid_lft forever preferred_lft forever
2: eno1: <BROADCAST,MULTICAST,UP,LOWER_UP> mtu 9000 qdisc mq state UP group default qlen 1000
    link/ether d8:5e:d3:8c:5c:ed brd ff:ff:ff:ff:ff:ff
    altname enp3s0f0
    inet6 fe80::da5e:d3ff:fe8c:5ced/64 scope link
       valid_lft forever preferred_lft forever
3: eno2: <BROADCAST,MULTICAST> mtu 1500 qdisc noop state DOWN group default qlen 1000
    link/ether d8:5e:d3:8c:5c:ee brd ff:ff:ff:ff:ff:ff
    altname enp3s0f1
4: ens11f0np0: <BROADCAST,MULTICAST,SLAVE,UP,LOWER_UP> mtu 9000 qdisc mq master bond0 state UP group default qlen 1000
    link/ether 36:67:4d:d8:df:20 brd ff:ff:ff:ff:ff:ff permaddr 5c:25:73:d5:6b:ce
    altname enp103s0f0np0
5: ens11f1np1: <BROADCAST,MULTICAST,SLAVE,UP,LOWER_UP> mtu 9000 qdisc mq master bond0 state UP group default qlen 1000
    link/ether 36:67:4d:d8:df:20 brd ff:ff:ff:ff:ff:ff permaddr 5c:25:73:d5:6b:cf
    altname enp103s0f1np1
6: bond0: <BROADCAST,MULTICAST,MASTER,UP,LOWER_UP> mtu 9000 qdisc noqueue state UP group default qlen 1000
    link/ether 36:67:4d:d8:df:20 brd ff:ff:ff:ff:ff:ff
    inet6 fe80::3467:4dff:fed8:df20/64 scope link
       valid_lft forever preferred_lft forever
7: ibs3: <BROADCAST,MULTICAST,UP,LOWER_UP> mtu 4092 qdisc mq state UP group default qlen 1000
    link/infiniband 00:00:0e:1a:fe:80:00:00:00:00:00:00:5c:25:73:03:00:ab:f1:14 brd 00:ff:ff:ff:ff:12:40:1b:ff:ff:00:00:00:00:00:00:ff:ff:ff:ff
    altname ibp9s0
    inet6 fe80::5e25:7303:ab:f114/64 scope link
       valid_lft forever preferred_lft forever
8: ibs2: <BROADCAST,MULTICAST,UP,LOWER_UP> mtu 4092 qdisc mq state UP group default qlen 1000
    link/infiniband 00:00:10:47:fe:80:00:00:00:00:00:00:5c:25:73:03:00:ab:e7:f4 brd 00:ff:ff:ff:ff:12:40:1b:ff:ff:00:00:00:00:00:00:ff:ff:ff:ff
    altname ibp23s0
    inet6 fe80::5e25:7303:ab:e7f4/64 scope link
       valid_lft forever preferred_lft forever
9: ibs4: <BROADCAST,MULTICAST,UP,LOWER_UP> mtu 4092 qdisc mq state UP group default qlen 1000
    link/infiniband 00:00:10:47:fe:80:00:00:00:00:00:00:5c:25:73:03:00:ab:e7:d4 brd 00:ff:ff:ff:ff:12:40:1b:ff:ff:00:00:00:00:00:00:ff:ff:ff:ff
    altname ibp58s0
    inet6 fe80::5e25:7303:ab:e7d4/64 scope link
       valid_lft forever preferred_lft forever
10: ibs1: <BROADCAST,MULTICAST,UP,LOWER_UP> mtu 4092 qdisc mq state UP group default qlen 1000
    link/infiniband 00:00:10:47:fe:80:00:00:00:00:00:00:5c:25:73:03:00:ab:b8:44 brd 00:ff:ff:ff:ff:12:40:1b:ff:ff:00:00:00:00:00:00:ff:ff:ff:ff
    altname ibp67s0
    inet6 fe80::5e25:7303:ab:b844/64 scope link
       valid_lft forever preferred_lft forever
11: ibs8: <BROADCAST,MULTICAST,UP,LOWER_UP> mtu 4092 qdisc mq state UP group default qlen 1000
    link/infiniband 00:00:10:47:fe:80:00:00:00:00:00:00:5c:25:73:03:00:ab:f0:ec brd 00:ff:ff:ff:ff:12:40:1b:ff:ff:00:00:00:00:00:00:ff:ff:ff:ff
    altname ibp134s0
    inet6 fe80::5e25:7303:ab:f0ec/64 scope link
       valid_lft forever preferred_lft forever
12: ibs7: <BROADCAST,MULTICAST,UP,LOWER_UP> mtu 4092 qdisc mq state UP group default qlen 1000
    link/infiniband 00:00:10:47:fe:80:00:00:00:00:00:00:5c:25:73:03:00:ab:ad:a4 brd 00:ff:ff:ff:ff:12:40:1b:ff:ff:00:00:00:00:00:00:ff:ff:ff:ff
    altname ibp143s0
    inet6 fe80::5e25:7303:ab:ada4/64 scope link
       valid_lft forever preferred_lft forever
13: ibs6: <BROADCAST,MULTICAST,UP,LOWER_UP> mtu 4092 qdisc mq state UP group default qlen 1000
    link/infiniband 00:00:10:47:fe:80:00:00:00:00:00:00:5c:25:73:03:00:ab:f0:c4 brd 00:ff:ff:ff:ff:12:40:1b:ff:ff:00:00:00:00:00:00:ff:ff:ff:ff
    altname ibp183s0
    inet6 fe80::5e25:7303:ab:f0c4/64 scope link
       valid_lft forever preferred_lft forever
14: ibs5: <BROADCAST,MULTICAST,UP,LOWER_UP> mtu 4092 qdisc mq state UP group default qlen 1000
    link/infiniband 00:00:10:47:fe:80:00:00:00:00:00:00:5c:25:73:03:00:ab:b7:84 brd 00:ff:ff:ff:ff:12:40:1b:ff:ff:00:00:00:00:00:00:ff:ff:ff:ff
    altname ibp192s0
    inet6 fe80::5e25:7303:ab:b784/64 scope link
       valid_lft forever preferred_lft forever
15: bond0.3002@bond0: <BROADCAST,MULTICAST,UP,LOWER_UP> mtu 9000 qdisc noqueue state UP group default qlen 1000
    link/ether 36:67:4d:d8:df:20 brd ff:ff:ff:ff:ff:ff
    inet 10.239.17.10/20 brd 10.239.31.255 scope global bond0.3002
       valid_lft forever preferred_lft forever
    inet 10.239.26.4/20 brd 10.239.31.255 scope global secondary bond0.3002
       valid_lft forever preferred_lft forever
    inet6 fe80::3467:4dff:fed8:df20/64 scope link
       valid_lft forever preferred_lft forever
16: kube-ipvs0: <BROADCAST,NOARP> mtu 1500 qdisc noop state DOWN group default
    link/ether f6:d8:71:2f:bd:62 brd ff:ff:ff:ff:ff:ff
    inet 10.110.33.206/32 scope global kube-ipvs0
       valid_lft forever preferred_lft forever
    inet 10.110.104.45/32 scope global kube-ipvs0
       valid_lft forever preferred_lft forever
    inet 10.110.16.217/32 scope global kube-ipvs0
       valid_lft forever preferred_lft forever
    inet 10.110.241.78/32 scope global kube-ipvs0
       valid_lft forever preferred_lft forever
    inet 10.110.229.171/32 scope global kube-ipvs0
       valid_lft forever preferred_lft forever
    inet 10.110.0.1/32 scope global kube-ipvs0
       valid_lft forever preferred_lft forever
    inet 10.110.0.10/32 scope global kube-ipvs0
       valid_lft forever preferred_lft forever
    inet 10.110.118.63/32 scope global kube-ipvs0
       valid_lft forever preferred_lft forever
    inet 10.110.88.55/32 scope global kube-ipvs0
       valid_lft forever preferred_lft forever
    inet 10.110.20.137/32 scope global kube-ipvs0
       valid_lft forever preferred_lft forever
    inet 10.110.47.126/32 scope global kube-ipvs0
       valid_lft forever preferred_lft forever
    inet 10.110.176.178/32 scope global kube-ipvs0
       valid_lft forever preferred_lft forever
    inet 10.110.127.108/32 scope global kube-ipvs0
       valid_lft forever preferred_lft forever
    inet 10.110.18.58/32 scope global kube-ipvs0
       valid_lft forever preferred_lft forever
    inet 10.110.212.245/32 scope global kube-ipvs0
       valid_lft forever preferred_lft forever
    inet 10.110.40.18/32 scope global kube-ipvs0
       valid_lft forever preferred_lft forever
    inet 10.239.26.1/32 scope global kube-ipvs0
       valid_lft forever preferred_lft forever
    inet 10.239.26.2/32 scope global kube-ipvs0
       valid_lft forever preferred_lft forever
17: kube-lb0: <BROADCAST,NOARP,UP,LOWER_UP> mtu 1500 qdisc noqueue state UNKNOWN group default qlen 1000
    link/ether c6:c6:e8:a6:e5:4e brd ff:ff:ff:ff:ff:ff
    inet6 fe80::b4ce:94ff:febb:a61d/64 scope link
       valid_lft forever preferred_lft forever
18: cali5abca9a20b8@if2: <BROADCAST,MULTICAST,UP,LOWER_UP> mtu 4042 qdisc noqueue state UP group default qlen 1000
    link/ether ee:ee:ee:ee:ee:ee brd ff:ff:ff:ff:ff:ff link-netns cni-ca196fcc-aa8f-6e87-2eb2-03815c574a3c
    inet6 fe80::ecee:eeff:feee:eeee/64 scope link
       valid_lft forever preferred_lft forever
20: cali72199f7015c@if2: <BROADCAST,MULTICAST,UP,LOWER_UP> mtu 4042 qdisc noqueue state UP group default qlen 1000
    link/ether ee:ee:ee:ee:ee:ee brd ff:ff:ff:ff:ff:ff link-netns cni-63a3af2f-28d7-f71d-7fbc-65dfde5bad63
    inet6 fe80::ecee:eeff:feee:eeee/64 scope link
       valid_lft forever preferred_lft forever
21: califef0bc22feb@if2: <BROADCAST,MULTICAST,UP,LOWER_UP> mtu 4042 qdisc noqueue state UP group default qlen 1000
    link/ether ee:ee:ee:ee:ee:ee brd ff:ff:ff:ff:ff:ff link-netns cni-8e95399e-3069-a3d9-df71-4cba4bc90d8f
    inet6 fe80::ecee:eeff:feee:eeee/64 scope link
       valid_lft forever preferred_lft forever
22: cali01a377c2e85@if2: <BROADCAST,MULTICAST,UP,LOWER_UP> mtu 4042 qdisc noqueue state UP group default qlen 1000
    link/ether ee:ee:ee:ee:ee:ee brd ff:ff:ff:ff:ff:ff link-netns cni-58a3b1f8-510b-e47e-82e7-5fcd9574190d
    inet6 fe80::ecee:eeff:feee:eeee/64 scope link
       valid_lft forever preferred_lft forever
23: cali6ff50206ec9@if2: <BROADCAST,MULTICAST,UP,LOWER_UP> mtu 4042 qdisc noqueue state UP group default qlen 1000
    link/ether ee:ee:ee:ee:ee:ee brd ff:ff:ff:ff:ff:ff link-netns cni-fccbbdb3-2d49-fe8d-2c95-721129c7ef33
    inet6 fe80::ecee:eeff:feee:eeee/64 scope link
       valid_lft forever preferred_lft forever
24: caliadcbc557ae8@if2: <BROADCAST,MULTICAST,UP,LOWER_UP> mtu 4042 qdisc noqueue state UP group default qlen 1000
    link/ether ee:ee:ee:ee:ee:ee brd ff:ff:ff:ff:ff:ff link-netns cni-ee6752f2-c3a6-93d5-c784-b91a47573ac2
    inet6 fe80::ecee:eeff:feee:eeee/64 scope link
       valid_lft forever preferred_lft forever
25: cali97f907a8190@if2: <BROADCAST,MULTICAST,UP,LOWER_UP> mtu 4042 qdisc noqueue state UP group default qlen 1000
    link/ether ee:ee:ee:ee:ee:ee brd ff:ff:ff:ff:ff:ff link-netns cni-ea1dc823-d9a8-4979-3599-222ee1469068
    inet6 fe80::ecee:eeff:feee:eeee/64 scope link
       valid_lft forever preferred_lft forever
26: egress.vxlan: <BROADCAST,MULTICAST,UP,LOWER_UP> mtu 8950 qdisc noqueue state UNKNOWN group default
    link/ether 66:9c:aa:94:fc:51 brd ff:ff:ff:ff:ff:ff
    inet 10.120.210.146/16 brd 10.120.255.255 scope global egress.vxlan
       valid_lft forever preferred_lft forever
    inet6 fe80::649c:aaff:fe94:fc51/64 scope link
       valid_lft forever preferred_lft forever
27: calid2faaa3a8df@if2: <BROADCAST,MULTICAST,UP,LOWER_UP> mtu 4042 qdisc noqueue state UP group default qlen 1000
    link/ether ee:ee:ee:ee:ee:ee brd ff:ff:ff:ff:ff:ff link-netns cni-e79f3733-5f87-5e4d-39cd-8a2f202c4f95
    inet6 fe80::ecee:eeff:feee:eeee/64 scope link
       valid_lft forever preferred_lft forever
28: vxlan.calico: <BROADCAST,MULTICAST,UP,LOWER_UP> mtu 4042 qdisc noqueue state UNKNOWN group default qlen 1000
    link/ether 66:95:18:70:ed:e5 brd ff:ff:ff:ff:ff:ff
    inet 10.100.123.192/32 scope global vxlan.calico
       valid_lft forever preferred_lft forever
    inet6 fe80::6495:18ff:fe70:ede5/64 scope link
       valid_lft forever preferred_lft forever
34: calic79234d36a5@if2: <BROADCAST,MULTICAST,UP,LOWER_UP> mtu 4042 qdisc noqueue state UP group default qlen 1000
    link/ether ee:ee:ee:ee:ee:ee brd ff:ff:ff:ff:ff:ff link-netns cni-cea32da0-eceb-bcc9-e880-a05c1f987877
    inet6 fe80::ecee:eeff:feee:eeee/64 scope link
       valid_lft forever preferred_lft forever
35: cali4ab24bb9148@if2: <BROADCAST,MULTICAST,UP,LOWER_UP> mtu 4042 qdisc noqueue state UP group default qlen 1000
    link/ether ee:ee:ee:ee:ee:ee brd ff:ff:ff:ff:ff:ff link-netns cni-ef2e1f06-ee98-f178-22d7-ccbe19804d6b
    inet6 fe80::ecee:eeff:feee:eeee/64 scope link
       valid_lft forever preferred_lft forever
```

**Comment by huizsh** [comment]
@lou-lan I tried 0.6.7, but the result is the same. I've attached the output as requested. Please take a look. Thanks!

**Comment by lou-lan** [comment]
@huizsh 

It looks like E`GRESSGATEWAY-REPLY-ROUTING` didn’t match any traffic. Should we first check whether the request to google.com actually receives any response?

The IP 74.125.68.104 is the DNS resolution result for www.google.com from https://www.nslookup.io/. Using the IP directly avoids issues where DNS load balancers return different addresses, which makes packet capturing harder.
You can also replace 74.125.68.104 with any IP that is convenient for your testing.

1.	Please run the following on worker1: `tcpdump -i any host 74.125.68.104 -nnvvee`
2.	Then execute `curl 74.125.68.104` inside the Pod on worker2
3.	Finally, please provide the packet capture results from worker1

**Comment by huizsh** [comment]
```
root@ce-master01:~# kubectl exec -it visitor-ff9c497bb-krzrn -- bash
root@visitor-ff9c497bb-krzrn:/# curl http://google.com
curl: (28) Failed to connect to google.com port 80 after 129658 ms: Could not connect to server
root@visitor-ff9c497bb-krzrn:/# curl 74.125.68.104

``` 

worker01:
```
root@ce-worker01:~# tcpdump -i any host 74.125.68.104 -nnvvee
tcpdump: data link type LINUX_SLL2
tcpdump: listening on any, link-type LINUX_SLL2 (Linux cooked v2), snapshot length 262144 bytes
02:37:46.710304 egress.vxlan P   ifindex 28 66:9c:aa:94:fc:51 ethertype IPv4 (0x0800), length 80: (tos 0x0, ttl 63, id 37166, offset 0, flags [DF], proto TCP (6), length 60)
    10.100.123.236.34842 > 74.125.68.104.80: Flags [S], cksum 0xa4b3 (correct), seq 279561914, win 64032, options [mss 4002,sackOK,TS val 501681235 ecr 0,nop,wscale 7], length 0
02:37:47.729867 egress.vxlan P   ifindex 28 66:9c:aa:94:fc:51 ethertype IPv4 (0x0800), length 80: (tos 0x0, ttl 63, id 37167, offset 0, flags [DF], proto TCP (6), length 60)
    10.100.123.236.34842 > 74.125.68.104.80: Flags [S], cksum 0xa0b7 (correct), seq 279561914, win 64032, options [mss 4002,sackOK,TS val 501682255 ecr 0,nop,wscale 7], length 0
02:37:49.745860 egress.vxlan P   ifindex 28 66:9c:aa:94:fc:51 ethertype IPv4 (0x0800), length 80: (tos 0x0, ttl 63, id 37168, offset 0, flags [DF], proto TCP (6), length 60)
    10.100.123.236.34842 > 74.125.68.104.80: Flags [S], cksum 0x98d7 (correct), seq 279561914, win 64032, options [mss 4002,sackOK,TS val 501684271 ecr 0,nop,wscale 7], length 0
02:37:53.905896 egress.vxlan P   ifindex 28 66:9c:aa:94:fc:51 ethertype IPv4 (0x0800), length 80: (tos 0x0, ttl 63, id 37169, offset 0, flags [DF], proto TCP (6), length 60)
    10.100.123.236.34842 > 74.125.68.104.80: Flags [S], cksum 0x8897 (correct), seq 279561914, win 64032, options [mss 4002,sackOK,TS val 501688431 ecr 0,nop,wscale 7], length 0
02:38:02.097930 egress.vxlan P   ifindex 28 66:9c:aa:94:fc:51 ethertype IPv4 (0x0800), length 80: (tos 0x0, ttl 63, id 37170, offset 0, flags [DF], proto TCP (6), length 60)
    10.100.123.236.34842 > 74.125.68.104.80: Flags [S], cksum 0x6897 (correct), seq 279561914, win 64032, options [mss 4002,sackOK,TS val 501696623 ecr 0,nop,wscale 7], length 0
02:38:18.225894 egress.vxlan P   ifindex 28 66:9c:aa:94:fc:51 ethertype IPv4 (0x0800), length 80: (tos 0x0, ttl 63, id 37171, offset 0, flags [DF], proto TCP (6), length 60)
    10.100.123.236.34842 > 74.125.68.104.80: Flags [S], cksum 0x2997 (correct), seq 279561914, win 64032, options [mss 4002,sackOK,TS val 501712751 ecr 0,nop,wscale 7], length 0

``` 
@lou-lan

**Comment by lou-lan** [comment]
@huizsh 
iptables -t raw -nvL cali-PREROUTING
```diff
-A cali-PREROUTING -m comment --comment "cali:uvipz_NmQPrGYnTB" -m mark --mark 0x80000/0x80000 -m rpfilter --validmark --invert -j DROP # my cluster
+A cali-PREROUTING -m comment --comment "cali:ZRno2gPYKT_N2WJV" -m rpfilter --validmark --invert -j DROP # you cluster
```
(Your worker1 iptables rule miss `--mark 0x80000/0x80000`.)

The traffic on worker1 is being dropped by Calico’s iptables rules before anything else. I’m still checking the Calico documentation to see which configuration is responsible. Which version of Calico are you using? Also, could you provide the output of the following command:
```
kubectl get felixconfigurations.crd.projectcalico.org default -o yaml
```

**Comment by lou-lan** [comment]
@huizsh 
https://github.com/projectcalico/calico/blob/v3.29.1/felix/rules/static.go#L1387

The code logic in version 3.29.1 also includes mask and mark. However, it seems your cluster doesn’t have this conditional filtering. Please run the following again on worker1 to check:
```
iptables -t raw -nvL cali-PREROUTING
```
And please provide the output.

**Comment by huizsh** [comment]
root@ce-worker01:~# iptables -t raw -nvL cali-PREROUTING
Chain cali-PREROUTING (1 references)
 pkts bytes target     prot opt in     out     source               destination
6281M 2455G MARK       all  --  *      *       0.0.0.0/0            0.0.0.0/0            /* cali:XFX5xbM8B9qR10JG */ MARK and 0xfff0ffff
 133M   99G CT         udp  --  *      *       0.0.0.0/0            0.0.0.0/0            /* cali:M7WeklUcDzCqHKI_ */ NOTRACK
3644M  983G MARK       all  --  cali+  *       0.0.0.0/0            0.0.0.0/0            /* cali:pNzLEcwGOZ4YemC- */ MARK or 0x40000
3644M  983G cali-rpf-skip  all  --  *      *       0.0.0.0/0            0.0.0.0/0            /* cali:k5-EypuOGdQbMjmG */
    0     0 DROP       all  --  *      *       0.0.0.0/0            0.0.0.0/0            /* cali:ZRno2gPYKT_N2WJV */ rpfilter validmark invert
2637M 1472G cali-from-host-endpoint  all  --  *      *       0.0.0.0/0            0.0.0.0/0            /* cali:oBQn3t8RvFIlNu_v */
    0     0 ACCEPT     all  --  *      *       0.0.0.0/0            0.0.0.0/0            /* cali:lZy_EB5TkNFykbsd */

@lou-lan

**Comment by lou-lan** [comment]
Although this rule looks strange, it doesn’t seem to be causing the issue, because the traffic counter is 0. Please check again on worker1 with:

```
sysctl -a | grep rp_filter
```

**Comment by huizsh** [comment]
root@ce-worker01:~# sysctl -a | grep net.ipv4.ip_forward
net.ipv4.ip_forward = 1
net.ipv4.ip_forward_update_priority = 1
net.ipv4.ip_forward_use_pmtu = 0

**Comment by huizsh** [comment]
@lou-lan ubuntu22.04

**Comment by huizsh** [comment]
@lou-lan are you able to reproduce this?

**Comment by lou-lan** [comment]
> [@lou-lan](https://github.com/lou-lan) are you able to reproduce this?

Not reproduced.

<img width="1347" height="526" alt="Image" src="https://github.com/user-attachments/assets/3fc2a1b4-6f82-4852-b101-0e213f2e2e3d" />

<img width="1722" height="417" alt="Image" src="https://github.com/user-attachments/assets/afef93c9-c0e6-4bf3-8b1d-1d9bae2b2d5c" />

**Comment by lou-lan** [comment]
@huizsh 
On `ce-worker01` node:
* Please run `sudo update-alternatives --display iptables`
* Please run `sudo iptabels -V`
* Please run `sudo iptables-legacy -t mangle -nvL PREROUTING`

**Comment by lou-lan** [comment]
@huizsh 

I saw that you added some iptables logs. Did you notice any increase in the traffic counters?

```bash
-A PREROUTING -i egress.vxlan -m limit --limit 20/min -j LOG --log-prefix "PREROUTING-VXLAN: "
```

If not, add debug log to `raw` table:
```bash
sudo iptables -t raw -I PREROUTING 1 -i egress.vxlan -m limit --limit 20/min -j LOG --log-prefix "RAW-PREROUTING-VXLAN: "
```

**Comment by huizsh** [comment]
```
root@ce-master01:~# kubectl exec -it visitor-ff9c497bb-krzrn -- bash
root@visitor-ff9c497bb-krzrn:/# curl 74.125.68.104


root@ce-worker01:~# sudo iptables -t raw -nvL PREROUTING
# Warning: iptables-legacy tables present, use iptables-legacy to see them
Chain PREROUTING (policy ACCEPT 0 packets, 0 bytes)
 pkts bytes target     prot opt in     out     source               destination
    0     0 LOG        all  --  egress.vxlan *       0.0.0.0/0            0.0.0.0/0            limit: avg 20/min burst 5 LOG flags 0 level 4 prefix "RAW-PREROUTING-VXLAN-FIRST: "
    0     0 LOG        all  --  egress.vxlan *       0.0.0.0/0            0.0.0.0/0            limit: avg 20/min burst 5 LOG flags 0 level 4 prefix "RAW-PREROUTING-VXLAN-LAST: "
92587  171M cali-PREROUTING  all  --  *      *       0.0.0.0/0            0.0.0.0/0            /* cali:6gwbT8clXdHdC1b1 */
root@ce-worker01:~# sudo iptables -t raw -nvL PREROUTING
# Warning: iptables-legacy tables present, use iptables-legacy to see them
Chain PREROUTING (policy ACCEPT 0 packets, 0 bytes)
 pkts bytes target     prot opt in     out     source               destination
    0     0 LOG        all  --  egress.vxlan *       0.0.0.0/0            0.0.0.0/0            limit: avg 20/min burst 5 LOG flags 0 level 4 prefix "RAW-PREROUTING-VXLAN-FIRST: "
    0     0 LOG        all  --  egress.vxlan *       0.0.0.0/0            0.0.0.0/0            limit: avg 20/min burst 5 LOG flags 0 level 4 prefix "RAW-PREROUTING-VXLAN-LAST: "
93226  172M cali-PREROUTING  all  --  *      *       0.0.0.0/0            0.0.0.0/0            /* cali:6gwbT8clXdHdC1b1 */
root@ce-worker01:~# sudo iptables -t raw -nvL PREROUTING
# Warning: iptables-legacy tables present, use iptables-legacy to see them
Chain PREROUTING (policy ACCEPT 0 packets, 0 bytes)
 pkts bytes target     prot opt in     out     source               destination
    0     0 LOG        all  --  egress.vxlan *       0.0.0.0/0            0.0.0.0/0            limit: avg 20/min burst 5 LOG flags 0 level 4 prefix "RAW-PREROUTING-VXLAN-FIRST: "
    0     0 LOG        all  --  egress.vxlan *       0.0.0.0/0            0.0.0.0/0            limit: avg 20/min burst 5 LOG flags 0 level 4 prefix "RAW-PREROUTING-VXLAN-LAST: "
93717  172M cali-PREROUTING  all  --  *      *       0.0.0.0/0            0.0.0.0/0            /* cali:6gwbT8clXdHdC1b1 */
root@ce-worker01:~# sudo iptables -t raw -nvL PREROUTING
# Warning: iptables-legacy tables present, use iptables-legacy to see them
Chain PREROUTING (policy ACCEPT 0 packets, 0 bytes)
 pkts bytes target     prot opt in     out     source               destination
    0     0 LOG        all  --  egress.vxlan *       0.0.0.0/0            0.0.0.0/0            limit: avg 20/min burst 5 LOG flags 0 level 4 prefix "RAW-PREROUTING-VXLAN-FIRST: "
    0     0 LOG        all  --  egress.vxlan *       0.0.0.0/0            0.0.0.0/0            limit: avg 20/min burst 5 LOG flags 0 level 4 prefix "RAW-PREROUTING-VXLAN-LAST: "
94127  173M cali-PREROUTING  all  --  *      *       0.0.0.0/0            0.0.0.0/0            /* cali:6gwbT8clXdHdC1b1 */
root@ce-worker01:~#``` 
@lou-lan yes, it increases

**Comment by huizsh** [comment]
Can we set up a call tomorrow morning around 10:00 AM China Time for a live debugging session? Please let me know if another time works better for you.
https://us05web.zoom.us/launch/chat?src=direct_chat_link&email=happyjasonz%40gmail.com

**Comment by lou-lan** [comment]
> Can we set up a call tomorrow morning around 10:00 AM China Time for a live debugging session? Please let me know if another time works better for you. https://us05web.zoom.us/launch/chat?src=direct_chat_link&email=happyjasonz%40gmail.com

ok, i will join the meeting.

**Comment by lou-lan** [comment]
> [@lou-lan](https://github.com/lou-lan) What’s your Zoom ID? I’ll add you to the scheduled meeting.

864 503 1873

**Comment by lou-lan** [comment]
The root cause was finally traced to the fact that the MAC address of `egress.vxlan` on worker02 did not match the MAC address shown by `kubectl get egt`. This indicates that the egress agent on that node did not synchronize the egress.vxlan interface as expected. Normally, such changes should be synchronized.

Further investigation based on the logs is needed to determine what caused this issue.

It is possible that the problem was caused by a failed reconcile due to an ipset delete operation.
